img_id	img_name	title
126180.jpg	polizei-einsatzwagen--1-.jpg	Mann liefert sich Verfolgungsjagd durch Ehrenfeld mit der Polizei
126181.jpg	71-143720832--null--11-02-2019-16-29-30-381-.jpg	Hinter den Kulissen des Stunks
126183.jpg	justitia-vor-blauem-himmel--1-.jpg	Mit Wasserpistole voll Buttersäure gespritzt?
126184.jpg	71-143781327--null--11-02-2019-18-24-00-383-.jpg	Posaunenchor Wirtenbach mit Filmmusik vom Feinsten
126186.jpg	szene-aus-brechtfilm.jpg	„Brecht kannte die Todesangst“
126187.jpg	grundschule-in-agathaberg.jpg	„Moderner Unterricht ist so nicht möglich“
126188.jpg	71-143808652--null--11-02-2019-18-04-46-887-.jpg	KV Rot-Weiß Fenke feiert närrisches Jubiläum
126189.jpg	dpa-buecher-buecherregal-lesen.jpg	Bücherei-Fusion mit Hückeswagen ist wohl vom Tisch
126191.jpg	71-143808194--null--11-02-2019-18-25-02-046-.jpg	Mobile Retter sind doppelt so schnell wie ein Rettungswagen
126193.jpg	freihandelsabkommen-eu-japan.jpg	NRW profitiert
126195.jpg	koelner-feuerwehr-twittert.jpg	So lief das Twitter-Gewitter bei der Kölner Feuerwehr
126196.jpg	71-143813442--null--11-02-2019-19-15-00-844-.jpg	Uber startet in Köln und will Taxis Konkurrenz machen
126197.jpg	der-taeter-vor-gericht.jpg	Täter bietet Opfer Schmerzensgeld an
126200.jpg	warnstreik-oeffentlicher-dienst.jpg	Mitarbeiter in Kliniken und Behörden streiken
126201.jpg	urn-newsml-dpa-com-20090101-190211-99-935909-large-4-3.jpg	Geduldsspiel beim FC Nürnberg - Frage nach Köllners Zukunft
126203.jpg	campingplatz-luegde-2.jpg	Zahl der Opfer in Lügde steigt auf 31
126207.jpg	akk-bei-klausurtagung-migration.jpg	CDU will bei Flüchtlingen „Humanität und Härte vereinen“
126209.jpg	kfz-zulassungsstelle-koeln.jpg	Kürzere Wartezeit und weniger Wut in der Kfz-Zulassungsstelle
126210.jpg	kabarettist-volker-weininger.jpg	Ein Tag im Karneval mit dem alkoholisierten „Sitzungspräsidenten“
126213.jpg	annegret-kramp-karrenbauer.jpg	Kramp-Karrenbauer hält nichts von Abkehr von Hartz IV
126215.jpg	spanischer-bau-rathaus--1-.jpg	Umweltschützer fühlen sich von Kölner Verwaltung verunglimpft
126219.jpg	urn-newsml-dpa-com-20090101-190208-99-906042-large-4-3.jpg	Die Klempnerin
126220.jpg	urn-newsml-dpa-com-20090101-190211-99-944365-large-4-3.jpg	Verdi: Warnstreiks an Unikliniken und Landesbehörden
126221.jpg	wer-hungrig-auf-eine-jecke-zeit-war--dem-wurde-schnell-geholfen-.jpg	Raderdoll im Haus Klippenberg
126222.jpg	bernard-haitink-am-pult.jpg	Brillanz trotz Grippe
126223.jpg	wer-regiert-die-welt--bei-den-61--grammys-die-frauen--von-links-oben-im-uhrzeigersinn--janelle-mon%C3%A1e--kacey-musgraves--jennifer-lopez--michelle---.jpg	Kacey Musgraves’ goldene Stunde
126224.jpg	die-zigarre-ist-immer-dabei--burghart-klaussner-als-alter-bertolt-brecht.jpg	„Er kannte die Angst vor dem Tod“
126225.jpg	brillantes-konzert-im-nicht-ausverkauften-saal--die-westdeutsche-sinfonia-leverkusen-gab-ihr-drittes-konzert-der-saison-.jpg	Emotionen statt Geschwindigkeit
126226.jpg	was-darf-bei-karneval-nicht-fehlen--richtig--kamelle-.jpg	Großer Trubel bei kleinen Narren
126227.jpg	unterhaltsames-konzert--der-bachchor-sang-rossini-.jpg	Messvertonung mit Fallstricken
126231.jpg	fahrerloser-bus.jpg	Einsatz von fahrerlosen Busse wäre in Hürth und Brühl möglich
126232.jpg	baustelle-schlossgalerie-freitreppe.jpg	Eröffnung von Schlossgalerie in Bensberg verschiebt sich bis November
126233.jpg	gemuend-von-oben.jpg	2019 nur vier verkaufsoffene Sonntage in Schleiden geplant
126235.jpg	urn-newsml-dpa-com-20090101-190211-99-943363-large-4-3.jpg	Bahamas per Postschiff erleben
126236.jpg	71-143802466--null--11-02-2019-16-27-15-859-.jpg	Zweite Ausfahrt zur Entlastung am Schulzentrum
126239.jpg	urn-newsml-dpa-com-20090101-190211-99-944839-large-4-3.jpg	Tui legt Zahlen zum ersten Quartal vor
126240.jpg	ko-tropfen-symbolbild.jpg	„Ich wäre vermutlich mit jedem ins Bett gegangen“
126245.jpg	kapitol-120219.jpg	Einigung im US-Haushaltsstreit verkündet
126246.jpg	71-143788243--null--11-02-2019-16-46-14-994-.jpg	Investoren planen Umbau in moderne Reitanlage und Wohnungen
126247.jpg	dlrg-overath-einsatzfahrzeug.jpg	DLRG Overath sucht neuen Stellplatz für Einsatzfahrzeug
126248.jpg	leerstehender-getraenkemarkt-frechen.jpg	Aus ehemaligen Trinkgut-Markt soll Eventhalle werden
126250.jpg	uwe-krause--fkp-praesident-aus-leverkusen.jpg	Die Leverkusener Narren plagen große Sorgen
126251.jpg	sek-symbolbild.jpg	Schwerbewaffnete in Parkhaus lösen SEK-Einsatz aus
126252.jpg	71-143795583--null--11-02-2019-17-05-36-159-.jpg	Leichlinger TV zieht beim Neujahrsempfang positive Bilanz
126253.jpg	urn-newsml-dpa-com-20090101-190212-99-949018-large-4-3.jpg	Max Mutzke bekommt Champagne-Preis für Lebensfreude
126254.jpg	trinkbrunnen.jpg	„Wasser Marsch“ für alle an der Merianstraße
126255.jpg	71-134121585--null--19-06-2018-14-49-51-030-.jpg	Jetzt sind Sandsäcke gefragt
126256.jpg	etwa-120-gaeste-kamen-ins-pfarrheim-zur-buerger-info-.jpg	330 Wohnungen für Weidenpesch
126258.jpg	haben-sich-mit-kostuemen-eingedeckt--gerda-wild--l---und-johanna-elkes--bild-rechts---ulrike--l---und-tamara-munsch--bild-mitte--standen-beratend---.jpg	Passendes für Engelchen und Teufelchen
126259.jpg	die-kita-klein-herl-eroeffnet-wesentlich-spaeter-als-urspruenglich-geplant-.jpg	Eltern fühlen sich von der Stadt verschaukelt
126260.jpg	kamlesh-chandna-praesentierte-ihre-geschichte-im-schattenspiel-.jpg	Spiel mit der eigenen Lebensgeschichte
126261.jpg	sabine-marquardt--2-v-l---bereitet-die-broetchen-fuer-den-backofen-vor-.jpg	Frisch und knusprig beim Chemiker
126262.jpg	das-buergerhaus-muetze-soll-eine-waermedaemmung-bekommen-.jpg	Fünf Millionen Euro für die Mütze
126263.jpg	patrick-coutu-beschaeftigt-sich-in-seinen-malerischen-und-plastischen-arbeiten-mit-komplexen-strukturen-.jpg	Unregelmäßiges aus Montreal
126264.jpg	arbeitsmarkt-migranten.jpg	Deutscher Arbeitsmarkt braucht Migranten aus Nicht-EU
126265.jpg	urn-newsml-dpa-com-20090101-190212-99-949194-large-4-3.jpg	Schweighöfer und Ruby O. Fee bei Berlinale-Party
126266.jpg	pyrotechnik-stadion.jpg	Dresden-Anhänger fackeln jede Menge Pyrotechnik im Stadion ab
126272.jpg	stau-die-hunderste.jpg	Bonner stehen laut Studie am meisten im Stau
126275.jpg	amazon-paket.jpg	Das müssen Empfänger beachten
126277.jpg	urn-newsml-dpa-com-20090101-190212-99-949585-large-4-3.jpg	Letzter deutscher Beitrag startet im Berlinale-Wettbewerb
126280.jpg	twenty-one-pilots.jpg	Wir verlosen Karten für das Konzert der Twenty Øne Piløts
126283.jpg	urn-newsml-dpa-com-20090101-190212-99-949898-large-4-3.jpg	Amazon kauft Anbieter von Wifi-Routern
126291.jpg	hitler-bild-2.jpg	Angebliche Hitler-Bilder vor Auktion beschlagnahmt
126292.jpg	urn-newsml-dpa-com-20090101-190212-99-950260-large-4-3.jpg	Berlinale-Wettbewerb: Top oder Flop?
126293.jpg	nuernberg-koellner.jpg	Sportvorstand Bornemann gefeuert – Trainer Köllner vor dem Aus
126294.jpg	urn-newsml-dpa-com-20090101-190212-99-949853-large-4-3.jpg	Experten: Kita-Milliarden nicht für Beitragsfreiheit nutzen
126297.jpg	seismogramm-symbol.jpg	Erneutes Erdbeben in Nacht zu Dienstag
126298.jpg	geo-info-tafeln-ruenderoth.jpg	NRW-Stiftung bezahlt Geo-Info-Tafeln in Ründeroth
126299.jpg	71-143785664--null--11-02-2019-17-15-41-498-.jpg	Eitorfer Frank Bohlscheid liebt den Blick auf die Sterne
126300.jpg	osaka-pokal.jpg	Osaka trennt sich überraschend von ihrem deutschen Trainer
126301.jpg	brennstoffzellen-busse-huerth.jpg	Brühl und Hürth als Modellregion ausgezeichnet
126302.jpg	pflege-symbolbild-dpa.jpg	NRW-Gesundheitsminister von Idee einer Pflegeschule angetan
126305.jpg	jonah-hill-afp-neu.jpg	Jonah Hill überzeugt auch als Regisseur
126307.jpg	harley-davidson.jpg	Harley Davidson stellt E-Motorrad und E-Scooter vor
126309.jpg	urn-newsml-dpa-com-20090101-190212-99-950768-large-4-3.jpg	Zehnte Staffel von „Pastewka” wird die letzte
126313.jpg	schweighoefer-und-ruby-berlinale.jpg	Matthias Schweighöfer und Ruby O. Fee zeigen sich bei Berlinale
126315.jpg	urn-newsml-dpa-com-20090101-190212-99-951103-large-4-3.jpg	Jury wirft Aachen Konfiszierung von Preisgeldern vor
126318.jpg	messi-barca.jpg	FC Barcelona leiht sich 140 Millionen Euro
126322.jpg	unfall-sao-paulo-ap-neu.jpg	Star-Journalist stirbt bei Hubschrauberabsturz
126324.jpg	f1-vettel.jpg	Sky sichert sich Formel-1-Rechte bis 2020
126326.jpg	urn-newsml-dpa-com-20090101-190212-99-951608-large-4-3.jpg	Englischer Weltmeister-Torwart Gordon Banks gestorben
126328.jpg	urn-newsml-dpa-com-20090101-190212-99-951796-large-4-3.jpg	1. FC Nürnberg trennt sich von Trainer Köllner
126329.jpg	lucke-ap-neu.jpg	Bernd Lucke schreibt Brandbrief an AfD
126330.jpg	prozess-gegen-katalanen.jpg	Prozess gegen katalanische Unabhängigkeitsführer hat begonnen
126333.jpg	foto-pastewka.jpg	Schluss mit Comedy-Serie „Pastewka“
126334.jpg	71-143792330--null--11-02-2019-18-04-47-987-.jpg	Rathaus arbeitet an Plänen – Anbau soll Platz schaffen
126338.jpg	bioladen.jpg	Männer sind Bio-Muffel
126339.jpg	sinfonia-forum.jpg	Westdeutsche Sinfonia Leverkusen spielt im Forum
126340.jpg	durchsuchungen-in-neuss.jpg	PKK-Vereinigungen verboten- Durchsuchungen in Neuss
126342.jpg	feuerwehr-kuechenbrand-fichtestrasse-steinbuechel.jpg	Löschender Nachbar verhindert Schlimmeres bei Küchenbrand
126345.jpg	schwebebahn.jpg	Reparatur der Wuppertaler Schwebebahn hat begonnen
126348.jpg	indien.jpg	Mutter und vier Kinder wegen Vorwurf der Hexerei ermordet
126349.jpg	urn-newsml-dpa-com-20090101-190212-99-953245-large-4-3.jpg	Glyphosat-Streit: EU will mehr Transparenz bei Zulassungen
126350.jpg	spd-kreismitglieder-diskutieren.jpg	SPD hält an Lösung für den Kreishaus-Anbau in Euskirchen fest
126352.jpg	ksta-unfall-luedinghausen-pol.jpg	Autofahrer muss niesen und überschlägt sich
126353.jpg	zittern-ist-training-korith.jpg	Mit diesem Training lassen sich Verspannungen wegzittern
126356.jpg	urn-newsml-dpa-com-20090101-190212-99-952905-large-4-3.jpg	Weitere Warnstreiks im öffentlichen Dienst
126357.jpg	willi-valder-maya-erdloch-porz-12-02-2019--5-.jpg	Kölner (59) lebt seit vier Monaten in Erdloch im Wald
126359.jpg	urn-newsml-dpa-com-20090101-190212-99-953458-large-4-3.jpg	Woidke begrüßt Zeitplan für Kohle-Strukturwandel-Maßnahmen
126363.jpg	angeklagte-kinderaerzte-duesseldorf-120119.jpg	Kinderärzte nach Tod eines Siebenjährigen freigesprochen
126393.jpg	schiff-rhein-feuer.jpg	Mit Kohle beladener Frachter brennt auf dem Rhein
126364.jpg	vater-bringt-kind-zur-schule.jpg	Wenn Eltern die Angst um ihr Kind verrückt macht
126365.jpg	symbolbild-bahn.jpg	Planung für neue Bahn nach Mülheim macht Fortschritte
126367.jpg	urn-newsml-dpa-com-20090101-190212-99-954243-large-4-3.jpg	Rätselraten um vorgebliche Amazon-Pakete - Konzern reagiert
126368.jpg	urn-newsml-dpa-com-20090101-190212-99-954407-large-4-3.jpg	Polizeischüler soll Widerstand geleistet haben
126369.jpg	urn-newsml-dpa-com-20090101-190212-99-954395-large-4-3.jpg	Rätselraten um vorgebliche Amazon-Pakete: Konzern reagiert
126371.jpg	aaronramsey.jpg	Juventus zahlt Aaron Ramsey Rekordgehalt
126372.jpg	bvruehl-feuer-paketwagen-mkl-2-.jpg	Lieferwagen brennt in Brühl aus – bis zu 250 Pakete verbrannt
126374.jpg	eltern-mannheim-prozess.jpg	Pflegeeltern sollen Dreijährigen misshandelt haben
126375.jpg	ampeljeck.jpg	Bekommt Köln bald auch jecke Ampelmännchen?
126376.jpg	regina-king.jpg	Kölner Filmpalast lädt zur langen Oscar-Nacht
126377.jpg	michaelreschke.jpg	Sportvorstand Reschke entlassen – Hitzelsberger übernimmt
126378.jpg	immi-praesidentin-miriam-chebabi-und-christoph-kuckelkorn.jpg	Immis dürfen 2020 im Kölner Rosenmontagszug mitgehen
126379.jpg	hawaii-ap-neu.jpg	Wintereinbruch auf Hawaii
126380.jpg	mann-telefoniert-iphone.jpg	So werden Verbraucher jetzt vor betrügerischen Lock-Anrufen gewarnt
126381.jpg	nutria.jpg	Nutrias dürfen bald in Bonn nicht mehr gefüttert werden
126383.jpg	71-143810423--null--12-02-2019-13-14-47-100-.jpg	Dahlemer Zochleiter geht Karnevalssonntag in „Rente“
126385.jpg	1901-top-jeck-cd.jpg	Alle brandneuen Karnevalshits auf einer CD
126386.jpg	djamel-laroussi.jpg	Chor will nordafrikanische Lieder ins Kölsche übertragen
126387.jpg	jadon-sancho-hektik-am-flughafen.jpg	BVB-Stars Sancho und Diallo vergessen ihre Pässe
126389.jpg	ronaldo-cl.jpg	Die Champions League wird vorhersagbarer
126390.jpg	71-143790087--null--12-02-2019-14-18-36-878-.jpg	Einsatz eines Spezialbohrgerätes erforderlich
126392.jpg	urn-newsml-dpa-com-20090101-190212-99-955220-large-4-3.jpg	Beschwerde-Bericht fragt auch nach äußerer Erscheinung
126394.jpg	modestedienstag.jpg	Neue Frist verzögert Modeste-Entscheidung
126395.jpg	arzt--symbolbild-.jpg	700 Uniklinik-Mitarbeiter in Köln streiken
126396.jpg	urn-newsml-dpa-com-20090101-190212-99-955758-large-4-3.jpg	Fahrradfahrerin stirbt nach Zusammenstoß mit Lkw
126398.jpg	stau-symbolbild-dpa-neu.jpg	In dieser Stadt verlieren Sie die meiste Lebenszeit
126399.jpg	polizei-auf-der-duerener-strasse.jpg	Maskierter überfällt Juwelier in Köln-Lindenthal
126400.jpg	urn-newsml-dpa-com-20090101-190212-99-955556-large-4-3.jpg	Noch viele Gewerbegebiete in NRW ohne Glasfaseranschluss
126401.jpg	urn-newsml-dpa-com-20090101-190212-99-956022-large-4-3.jpg	Was Arbeitnehmer bei Kita-Streiks wissen müssen
126402.jpg	urn-newsml-dpa-com-20090101-190212-99-954755-large-4-3.jpg	Seehofer verbietet zwei PKK-Vereinigungen
126406.jpg	die-maedchensitzung-auf-der-einen-seite.jpg	Herren- und Mädchensitzung auf einmal im Kölner Sartory
126407.jpg	urn-newsml-dpa-com-20090101-190212-99-956419-large-4-3.jpg	Schalkes früherer Manager Assauer in aller Stille beisetzt
126409.jpg	koelner-dom-von-oben.jpg	Kölner Wissenschaftsrunde widmet sich Europa
126410.jpg	pkk-razzia-dpa.jpg	Razzia bei PKK-nahen Verlagen in Neuss – weit verzweigtes Netz
126412.jpg	ehrenfelder-moschee.jpg	Erstes Festival der Religionen in Köln
126414.jpg	assauer-schalke.jpg	Rudi Assauer im engsten Familienkreis beigesetzt
126417.jpg	urn-newsml-dpa-com-20090101-190212-99-957209-large-4-3.jpg	Tilda Swinton mit ihrer Tochter auf der Berlinale
126419.jpg	71-143839389--null--12-02-2019-16-14-46-455-.jpg	Lange Staus nach Karambolage in Niederseßmar
126420.jpg	feuerwehr-symbol-020119.jpg	Nachbar findet brennende Küchenhandtücher auf Herd
126421.jpg	bayern-cl.jpg	Das Langeweile-Problem der Champions League
126422.jpg	71-143840599--null--12-02-2019-15-52-36-433-.jpg	Sieger der 58. Mathe-Olympiade ausgezeichnet
126424.jpg	71-141473276--null--11-12-2018-17-02-40-600-.jpg	Anwohner begründen Antrag auf Tempo-30-Zone
126426.jpg	brand-rohrmoser.jpg	Eine Person bei Hausbrand in Windeck schwer verletzt
126427.jpg	karibikstrand.jpg	Firma sucht Weltenbummler und zahlt 6800 Euro fürs Urlaubmachen
126430.jpg	urn-newsml-dpa-com-20090101-190212-99-954437-large-4-3.jpg	Große Tizian-Schau im Frankfurter Städel
126431.jpg	71-143833597--null--12-02-2019-15-51-54-331-.jpg	Milchentdecker-Tour macht Halt in Grundschule Becke
126433.jpg	frankfurter-strasse-koeln-muelheim.jpg	Kölner Imbiss-Chef leidet psychisch massiv unter Messer-Angriff
126434.jpg	firma-oni.jpg	ONI Wärmetrafo steigert Umsatz auf 88 Millionen Euro
126436.jpg	leyla-gueven-hungerstreik2.jpg	Leverkusener beteiligen sich an Hungerstreik für Politikerin
126437.jpg	5f9c98006fd0a84d.jpg	Seehofer verbietet zwei kurdische Organisationen
126438.jpg	stadion-krasnodar.jpg	„Leverkusen wird dort Top-Bedingungen vorfinden“
126440.jpg	kerpener-hund-saeureopfer-120219.jpg	Schäferhund in Kerpen mit Säure überschüttet
126442.jpg	alexa-voice-assistant-google-sprachassistent.jpg	„Die Maschine muss sich den Menschen annähern“
126444.jpg	trinkwasserbrunnen.jpg	Diskussion um Wasserspender für Köln-Mülheim
126445.jpg	pendler-parkplaetze-stelzenautobahn-leverkusen.jpg	Kritik an der Verwaltung zum Parken unter der Stelze
126449.jpg	unfall-lohmar-120219.jpg	19-Jähriger bei Unfall in Lohmar verletzt
126456.jpg	urn-newsml-dpa-com-20090101-190212-99-958882-large-4-3.jpg	Meghan löst Trend mit Bananen-Botschaften aus
126457.jpg	polizeiausweis.jpg	Zahl der Straftaten gegen Senioren in NRW steigt
126460.jpg	joaqu%C3%ADn-el-chapo-guzm%C3%A1n.jpg	Hartes Urteil für den mexikanischen Drogenboss „El Chapo“
126462.jpg	miljoe-wohnzimmerkonzert-brasserie-aller-koloer-band.jpg	Miljö mit neuem Song „Einer, dä dich leev hät“
126463.jpg	urn-newsml-dpa-com-20090101-190212-99-954114-large-4-3.jpg	Sparkassenkunden halten an Sparbuch und Co. fest
126465.jpg	unfall-auffahrt-euskirchen.jpg	Fahrer zieht unvermittelt auf Autobahn rüber – Kleinkind verletzt
126466.jpg	gouda-gerieben.jpg	Discounter Lidl ruft geriebenen Käse zurück
126468.jpg	ein-vw-polo.jpg	VW ruft 350 000 Polos zurück in die Werkstätten
126471.jpg	urn-newsml-dpa-com-20090101-190212-99-960774-large-4-3.jpg	Mozilla setzt für Firefox künftig auf KI von Spielefirma
126474.jpg	die-moderatoren-herr-tobias-und-professor-doktor-otto-liebermann-fuehrten-durch-die-verschiedenen-experimente-.jpg	Eskalieren im Baykomm
126475.jpg	lotte--alicia-von-rittberg--arbeitet-in-der-werkstatt-des-bauhaus-weimar-am-kleinen-schiffbauspiel-.jpg	Flucht vor dem Webstuhl
126477.jpg	71-143829171--null--12-02-2019-17-36-39-357-.jpg	„Guten Morgen, Barbarossaplatz, bist Du auch schon wach?“
126478.jpg	nord-stream-2.jpg	EU einigt sich auf Regeln für Nord Stream 2
126479.jpg	paprika-gibt-es-in-unterschiedlichen-farben.jpg	Grün, gelb, rot – welche Paprika hat am meisten Vitamine?
126480.jpg	71-143847627--null--12-02-2019-17-43-21-803-.jpg	Planer sind optimistisch – Suche nach Lösung für Thielenbrucher Moor
126481.jpg	a1-frechen-120219.jpg	A1 zwischen Dreieck Erfttal und Frechen gesperrt
126482.jpg	steingarten-hitdorf.jpg	Leichlingen sieht sich dem Klimaschutz bereits verpflichtet
126483.jpg	marienschule-trauer-lehrer.jpg	Marienschule Opladen trauert um gestorbenen Lehrer
126484.jpg	gospel-chor-wiehl.jpg	Gospel Chor Wiehl & Band entfachen Begeisterungsstürme
126485.jpg	1202-ww-bilder-025.jpg	CDU will Rathaus-Areal umbauen – Diskussion über Parkhaus am Bahnhof
126487.jpg	71-143378999--null--31-01-2019-15-53-27-353-.jpg	Wie das Brexit-Referendum ihre Identität verändert hat
126488.jpg	hundeshow-gewinner.jpg	Dieser Hund ist der neue Star in den USA
126789.jpg	urn-newsml-dpa-com-20090101-190213-99-963930-large-4-3.jpg	Anna Schudt sieht in Prügeleien unter Jungs auch Gutes
126489.jpg	abitur-130219.jpg	Schuldirektoren kritisieren zu gute Abinoten
126492.jpg	trump-el-paso.jpg	Trump-Anhänger attackiert Kameramann
126493.jpg	ville-express-120219--1-.jpg	Sanierung laut Stadt abgeschlossen – so geht es weiter
126494.jpg	mauer-mexiko-130219.jpg	Das Debakel des Dealmakers Trump
126496.jpg	kindergarten-gemuend-muesgesauel.jpg	Schleiden bekommt neue U3-Betreuungsplätze
126497.jpg	fischer-helene-dpa-neu.jpg	Helene Fischer verärgert ihre Fans
126498.jpg	meredienstag.jpg	Jorge Meré hat noch eine Rechnung offen
126500.jpg	fuehrerschein-130219.jpg	Immer mehr Fahrschüler fallen durch die Prüfung
126503.jpg	ice-dpa.jpg	ICE blockiert Gleise kurz vor Köln – Züge werden umgeleitet
126505.jpg	doerte-diemert.jpg	Kölner Verwaltung kann Steuern nicht eintreiben
127110.jpg	urn-newsml-dpa-com-20090101-190213-99-965680-large-4-3.jpg	Dicke Luft in Städten - ist der Diesel wirklich Schuld?
126661.jpg	urn-newsml-dpa-com-20090101-190213-99-965703-large-4-3.jpg	Richard Gere mit 69 Jahren Vater geworden
127109.jpg	urn-newsml-dpa-com-20090101-190212-99-959820-large-4-3.jpg	Nowitzki-Mentor über mögliches Karriere-Ende: „Alles offen”
126506.jpg	pappel-dhuenn.jpg	Bezirksvertreter prüfen Fällung von weiteren Pappeln
126507.jpg	verkehr-aachener-strasse.jpg	Wird die Aachener Straße in Köln für Autos einspurig?
127107.jpg	urn-newsml-dpa-com-20090101-190213-99-965965-large-4-3.jpg	Severin Freund nicht für WM in Seefeld nominiert
127119.jpg	urn-newsml-dpa-com-20090101-190213-99-966055-large-4-3.jpg	Erneut Hunderte Millionen Zugangsdaten im Netz aufgetaucht
127117.jpg	urn-newsml-dpa-com-20090101-190213-99-966101-large-4-3.jpg	Apple will rund Hälfte der Erlöse bei „Netflix für News”
126508.jpg	waldbroeler-gesamtschule.jpg	Es bleibt bei vier Klassen für Waldbröler Gesamtschule
127113.jpg	urn-newsml-dpa-com-20090101-190213-99-965998-large-4-3.jpg	Drahthaar-Foxterrier gewinnt Hundeshow
126509.jpg	horst-seehofer-130219.jpg	Seehofer lässt Parteimitgliedschaft von Beamten prüfen
126510.jpg	rolfes-krasnodar.jpg	Simon Rolfes warnt vor Gegner von „anderem Kaliber“
126512.jpg	stadthaus-130219.jpg	Viele wichtige Stellen müssen neu besetzt werden
126513.jpg	moerder-sarajevo.jpg	Bosnische Polizisten erschießen Serienmörder
126514.jpg	norbert-roehrich.jpg	Vom Sportgeschäft in den Literaturbetrieb
126515.jpg	rollator.jpg	99-Jährige bittet Polizei, ihren Heimtrainer zu reparieren
126516.jpg	l269.jpg	Experten lehnen Umweltspur auf der L269 ab
126518.jpg	abteipassage-brauweiler-120219.jpg	Initiative will Abriss der Abteipassage in Brauweiler verhindern
126519.jpg	kakerlake-130219.jpg	Zoo befriedigt private Rachegelüste – auf Kosten von Kakerlaken
126520.jpg	kaffeeeisenreich2.jpg	So rechnet eine Ladenbesitzerin mit der Zülpicher Straße ab
126521.jpg	bild-gere.jpg	Ein Kind für Hollywood-Star Richard Gere
126524.jpg	schwarzer-panther.jpg	Fotograf erwischt raren schwarzen Panther in der Wildnis
126525.jpg	donald-trump-071118-wahl.jpg	USA größte Weltbedrohung für Deutsche – Terrorangst sinkt
126526.jpg	axelwitsel.jpg	Axel Witsel schwärmt von Marco Reus und lobt die Bundesliga
126527.jpg	abiturschild.jpg	Mit dem Zentralabitur ist die Politik falsch abgebogen
126528.jpg	liebesbriefe-45056205.jpg	Liebesbriefarchiv in Koblenz bewahrt besondere Schätze
126529.jpg	71-143591824--null--12-02-2019-16-43-54-315-.jpg	„Erst möchte ich noch Prinz im Karneval werden“
126530.jpg	handschellen-dpa.jpg	Kriminalität in NRW auf niedrigstem Stand seit 1991
126531.jpg	dpa-notarzt-blaulicht-symbolbild.jpg	Linksabbieger übersieht Achtjährige – Kind schwerverletzt
126532.jpg	hallstatt-chinesen.jpg	In diesem Alpendorf kommen 1 Million Touristen auf 780 Einwohner
126533.jpg	urn-newsml-dpa-com-20090101-170429-99-257026-large-4-3.jpg	Feuerwehr rückt zu Dachstuhlbrand aus
126535.jpg	kingsley-schindler-verletzt.jpg	FC-Sommer-Zugang Schindler fällt wochenlang aus
126536.jpg	ikeamoebel.jpg	Ikea startet Testverkauf über Amazon
127121.jpg	urn-newsml-dpa-com-20090101-190213-99-966718-large-4-3.jpg	Gericht verhandelt über Diesel-Fahrverbot in Wiesbaden
126537.jpg	71-143875162--null--13-02-2019-12-14-26-039-.jpg	Gummersbacher Schüler treten im „Tigerenten Club“ auf
126539.jpg	obama-keys-grammys.jpg	Michelle Obama veröffentlicht Stichelei ihrer Mutter
126541.jpg	roesrath-bagatelle-130219.jpg	Kölner Gastronom schließt Kult-Lokal „Bagatelle“ in Rösrath
126542.jpg	gluehende-kohle-im-kopf-einer-wasserpfeife.jpg	Wie die Politik Wasserpfeifen-Raucher schützen will
126543.jpg	die-nord-sued-fahrt.jpg	Tausende Besucher erwartet – Aufruf zum Mitmachen
126544.jpg	gerettete-hunde-1.jpg	Tierschützer bewahren Hunderte Hunde vor Kochtopf
126545.jpg	sanierung-der-natursteinfassade.jpg	Bonner Münster ist in Teilen eingerüstet – Sanierung beginnt bald
126547.jpg	islandpferd.jpg	Wenn der Wolf das Pony frisst
126550.jpg	starenkasten.jpg	Motorradfahrer brettert mit Sohn an Schule vorbei
126551.jpg	dpa-gruene-symbolbild.jpg	Grüne kritisieren „unverantwortlichen Schattenhaushalt“
126552.jpg	180410-uw-streik-018-sveadu.jpg	Person unter Zug eingequetscht – Rettungskräfte im Einsatz
126553.jpg	anfang-fc.jpg	Markus Anfang über die Chancen von Anthony Modeste
126554.jpg	jva-euskirchen-eingang.jpg	JVA Euskirchen könnte vergrößert werden – Kritik vom Bürgermeister
126555.jpg	foto-elle.jpg	Elle Macpherson ärgert Richard Lugner schon jetzt
126556.jpg	gruppenfoto-apec-gipfel-2019.jpg	284 Luxus-Autos auf Papua-Neuguinea vermisst
126558.jpg	hecke-schneiden-dpa.jpg	Euskirchener Eigentümer sollen rechtzeitig ihre Hecken schneiden
126559.jpg	20182506-tb-polizei-einsatzwagen-01.jpg	90-jährige Kölnerin von unbekannter Frau im Hausflur überfallen
126561.jpg	nissan-gtr-symbolbild.jpg	Streit um manipulierten Tachostand landet vor Gericht
126562.jpg	frau-geld-in-der-hand.jpg	In diesen Berufen verdient man am besten – und am schlechtesten
126563.jpg	feuer-in-arnsberg.jpg	Arnsberger Feuerwehr birgt drei Tote
126564.jpg	rheinerft-polizist-dpa.jpg	900 Straftaten rund um den Hambacher Forst erfasst
126567.jpg	71-143834038--null--12-02-2019-18-56-46-875-.jpg	Rösrath verzichtet befristet auf neu Straßenausbaumaßnahmen
126653.jpg	urn-newsml-dpa-com-20090101-190213-99-971204-large-4-3.jpg	Michelle Obamas Mutter lästert über ihre Tochter
127220.jpg	urn-newsml-dpa-com-20090101-190213-99-971720-large-4-3.jpg	Valentinstag im Pariser Rodin-Museum
126569.jpg	ratssitzung.jpg	Kölner Eltern fordern Fortsetzung des Auswahlverfahrens
126571.jpg	champions-league-im-free-tv.jpg	FC Bayern fordert Königsklasse im Free-TV
126572.jpg	frozen-imago.jpg	Disney veröffentlicht ersten Trailer zu „Die Eiskönigin 2“
126573.jpg	carolin-kebekus-und-thomas-deloy.jpg	Carolin Kebekus hat jetzt ihren eigenen Likör
126576.jpg	dpa-audi-auspuff.jpg	EU gewährt Deutschland Spielraum bei Stickoxid-Grenzwerten
126578.jpg	109141430.jpg	Ein brutaler Check und seine Folgen
126579.jpg	urn-newsml-dpa-com-20090101-190213-99-972564-large-4-3.jpg	Viele beteiligen sich an Petition für spätere Einschulung
126580.jpg	bailey-flughafen.jpg	Leverkusens Herausforderung in Südrussland
126582.jpg	brand-gymnasium-schleiden.jpg	Deutlich wenige Straftaten – Höhere Aufklärungsquote
126583.jpg	yuyaosako.jpg	Osako Japans Fußballer des Jahres
126585.jpg	kirche-st--nikolaus-wipperfuerth.jpg	Kirchturmuhr der Nikolauskirche tickt wieder richtig
126586.jpg	71-143892710--null--13-02-2019-16-54-36-582-.jpg	Moderne LED-Technik für drei Turnhallen in Lindlar
126587.jpg	060219ebay-moerder04--1-.jpg	Kölner Gericht zweifelt finanzielles Motiv des Ebay-Käufers an
