img_id	img_name	title
124303.jpg	b-fbi-schlagloch-tunnel-1-010219.jpg	FBI findet 45 Meter langen Bankraub-Tunnel
124304.jpg	urn-newsml-dpa-com-20090101-190201-99-816758-large-4-3.jpg	Schröder plädiert für Gabriel-Comeback
124305.jpg	20180316-tb-polizei-streifenwagen-004.jpg	Mann von Nachbarssohn mit Messer schwer verletzt
124306.jpg	ursula-karusseit.jpg	Schauspielerin Ursula Karusseit ist tot
124307.jpg	1902-blumenstrauss.jpg	Der kölsche Rosenstrauß zum Valentinstag
124308.jpg	urn-newsml-dpa-com-20090101-190201-99-817249-large-4-3.jpg	Schauspielerin Ursula Karusseit gestorben
124316.jpg	dieringhauser-strasse-komplett-gesperrt.jpg	85-jährige Fußgängerin in Gummersbach schwer verletzt
124317.jpg	71-143350589--null--01-02-2019-16-56-16-027-.jpg	Als seine Freunde berühmt wurden
124459.jpg	gammelfleisch-dpa-neu.jpg	EU-Kommission ermittel in polnischen Fleischskandal
124318.jpg	peter-zysik.jpg	„Die haben den Laden wirklich vor die Wand gefahren“
124319.jpg	urn-newsml-dpa-com-20090101-190201-99-818149-large-4-3.jpg	WM-Gastgeber Katar gewinnt erstmals Asien-Cup
124321.jpg	hund-an-leine.jpg	Präparierte Hunde-Köder in Köln gefunden – Stadt ist alarmiert
124322.jpg	71-143421594--null--01-02-2019-17-26-52-254-.jpg	Auto kollidiert mit Radlader in Waldbröl
124323.jpg	bs-bergischerloewe3.jpg	Dampflok „Bergischer Löwe“ nimmt ab März Fahrt auf
124324.jpg	urn-newsml-dpa-com-20090101-190201-99-817987-large-4-3.jpg	Ist Krebs in 10 bis 20 Jahren besiegbar?
124327.jpg	suesser-frosch-im-schnee.jpg	So schön ist das Oberbergische im Winter
124329.jpg	71-143436756--null--01-02-2019-18-32-01-667-.jpg	Über 7000 Waldbesitzer aus Oberberg unter einem Dach
124330.jpg	maldeghem-dpa-neu.jpg	Verheerendes Bild für die Kulturstadt Köln
124331.jpg	manuel-neuer-verletzt.jpg	Top-Spiel ohne die Kapitäne Manuel Neuer und Lars Bender
124333.jpg	nowitzki-afp-neu.jpg	NBA-Boss nominiert Nowitzki nach
124335.jpg	buju-banton.jpg	Kölner Schwule kritisieren Summerjam-Festival scharf
124336.jpg	prozess-bonn.jpg	Zwei Männer legen Geständnisse ab – „Denkzettel“ verpasst
124357.jpg	deisel-fahrverbot.jpg	Kein Anlass zur Beruhigung für die Autofahrer
124359.jpg	feuerwehr-brand-kerpen-01022019--1-.jpg	Mann stirbt bei Wohnungsbrand
124360.jpg	urn-newsml-dpa-com-20090101-190202-99-821417-large-4-3.jpg	Semperopernball: Viele Stars - Delon verletzt
124361.jpg	die-burscheider-musikschule-laedt-wieder-zum-musikgarten-ein-.jpg	Erste Lieder lernen
124362.jpg	carl-philip-von-maldeghem-und-henriette-reker-am-vergangenen-freitag.jpg	„Schädlich für die gesamte Kultur“
124363.jpg	mann-hat-migraene.jpg	Neue Therapie – können Spritzen gegen Migräne helfen?
124365.jpg	71-143312007--null--01-02-2019-17-35-22-614-.jpg	Viele Oberberger ärgern sich über verspätete Briefe
124366.jpg	71-142783705--null--17-01-2019-10-27-36-265---1-.jpg	Geldstrafen für illegale Vermietungen könnten angehoben werden
124367.jpg	kaufhof-in-bruehl.jpg	Führung schweigt – Filliale bleibt vorerst offenbar geöffnet
124368.jpg	frau-spricht-mit-siri.jpg	Warum haben alle Sprachassistenten eine weibliche Stimme?
124369.jpg	sek-einsatz-bad-muenstereifel-is-terror.jpg	IS-Terrorist aus Bad Münstereifel kämpft gegen Abschiebung
124370.jpg	neuenhof010--1-.jpg	Gesamtschule Siegburg wird zur Talentschule
124371.jpg	kinder-protestieren-gegen-kuendigung-von-koch.jpg	Küche in Gladbacher Kita wegen Insolvenz des Trägers dichtgemacht
124372.jpg	leverkusen-autobahnbruecke-alf-0085.jpg	Durch den Tunnel geht es nur mit 100
124373.jpg	wu-schnee--1-.jpg	Salz streuen ist auch in Burscheid untersagt
124374.jpg	bmw-in-kueche-imago.jpg	BMW rast in Küchenwand – Bewohner bleiben unverletzt
124375.jpg	vehfks.jpg	Frühe Gegentore sind vermeidbar
124377.jpg	foto-dior.jpg	Der Traum von Weiblichkeit
124718.jpg	urn-newsml-dpa-com-20090101-190131-99-804100-large-4-3.jpg	Ministerin trifft insolvente Klinik-Betreiber
124380.jpg	unfall-a4-2.jpg	Auto fährt ungebremst auf stehenden Wagen auf – Zwei Verletzte
124381.jpg	dirk-nowitzki.jpg	Dirk Nowitzki tendiert zu Karriereende nach dieser NBA-Saison
124382.jpg	71-143411634--null--01-02-2019-16-57-31-055-.jpg	Hamleschers aus Engelskirchen feiern eiserne Hochzeit
124383.jpg	carl-philip-von-maldeghem.jpg	Abgesprungener Intendant wirft Stadt Provinzialität vor
124384.jpg	heiko-wrusch-illustrator-lohmar.jpg	Heiko Wrusch aus Lohmar illustriert Bücher mit viel Liebe zum Detail
124385.jpg	urn-newsml-dpa-com-20090101-190202-99-823251-large-4-3.jpg	Studie: Deutsche Neuwagen mit immer mehr PS
124386.jpg	staeaenefleejer-melina.jpg	Kölner Tanzmariechen erzählt von Mobbing-Erfahrungen
124388.jpg	spatenstisch-overather-feuerwache.jpg	Overath bekommt neue Rettungswache für sieben Millionen
124390.jpg	dieter-heinrich.jpg	Leverkusener Gärtner setzen sich zur Wehr
124391.jpg	putin.jpg	Russland will Abrüstungsvertrag aussetzen
124392.jpg	a1-anschlussstelle-blankenheim-blickrichtung-sueden.jpg	Experten beantworten am Mittwoch in Lommersdorf Bürger-Fragen
124395.jpg	maria-hilf-krankenhaus-bergheim.jpg	Krankenhaus in Bergheim schließt Geburtshilfe vor geplantem Termin
124396.jpg	urn-newsml-dpa-com-20090101-190202-99-822982-large-4-3.jpg	NFL: Fälschungen, Drohnen und ein exklusiver Club
124397.jpg	tempo-120.jpg	Deutsche Umwelthilfe argumentiert mit 26 Jahre alten Zahlen
124399.jpg	71-143291824--null--01-02-2019-17-32-17-697-.jpg	„Mal sehen, ob jemand Schulen gründet“
124401.jpg	71-143400851--null--01-02-2019-17-39-29-876-.jpg	Das Kind als Vater des Mannes
124403.jpg	beyonce-und-jay-z-56614948.jpg	Beyoncé und Jay-Z locken mit 30-Jahre-Ticket
124404.jpg	cannabis.jpg	Postbote verletzt sich – Polizei entdeckt Cannabisplantage
124405.jpg	minister-spahn.jpg	Mediziner widersprechen Krebs-Aussage von Minister Spahn
124406.jpg	robben-drakes-beach2.jpg	Robben kapern beliebten Touristen-Strand in Kalifornien
124408.jpg	polizei.jpg	Spezialeinheit nimmt mutmaßlichen Dealerbanden-Anführer fest
124409.jpg	ehrennadeln.jpg	Engagement der Bürger ist der Kitt fürs Zusammenleben
124411.jpg	altstadt-wird-autofrei.jpg	Kölner Altstadt wird in den kommenden zehn Jahren autofrei
124412.jpg	polizeiwagen-nahaufnahme-von-vorne--2-.jpg	Chihuahua-Besitzer ersticht Boxer-Mischling
124415.jpg	illionois-kaelte.jpg	45 Grad Temperaturanstieg in Illinois binnen einer Woche
124416.jpg	71-143439512--null--02-02-2019-14-44-20-395-.jpg	Jugend-Reisen von Milli-Görüs im Zwielicht
124418.jpg	71-143447471--null--02-02-2019-15-08-48-861-.jpg	Ideen für besseres Klima – Fahrverbote weiterhin möglich
124420.jpg	leon-de-kok.jpg	Das neue Café de Kok wird zur Kuchen-Institution für Zollstock
124421.jpg	tatort-verschwundene-kind.jpg	Fesselnder Krimi mit einer Weltpremiere
124423.jpg	papst-franziskus--020219.jpg	Für Papst Franziskus ist Abtreibung kein Menschenrecht
124426.jpg	ernst-fortuna.jpg	Fortuna Köln rutscht auf einen Abstiegsplatz
124428.jpg	wolgast-beerdigung-020219.jpg	Getötete Sechsjährige in Wolgast beigesetzt
124430.jpg	leverkusen-pappeln-am-deich--alf-1194.jpg	Baumschützerin stoppt Fällung großer Pappeln an der Dhünn
124431.jpg	stolberg.jpg	Geparktes Auto liegt plötzlich auf dem Dach
124432.jpg	71-143442319--null--02-02-2019-16-19-40-022-.jpg	Anlieger ist sich mit Kürtener Gemeindeverwaltung uneinig
124433.jpg	volland.jpg	Bayer 04 bezwingt FC Bayern nach Rückstand
124434.jpg	wolle-petry-musical.jpg	Wolfgang Petrys „Wahnsinn“ kommt auf die Bühne
124435.jpg	anfang-foersterei.jpg	Die Chance auf einen wichtigen Schritt
124436.jpg	venezuela-unruhen-020219-dpa.jpg	Luftwaffengeneral in Venezuela stellt sich gegen Maduro
124437.jpg	5f9c8400cb1ef507.jpg	Leverkusens Offensiv-Leute überzeugen gegen Bayern
124438.jpg	krupp-haie.jpg	Kölner Haie suchen neuen Trainer – Krupp ein Kandidat?
124439.jpg	us-gouverneur-dpa-020219.jpg	Rückrittsforderungen gegen US-Gouverneur nach Skandal-Foto
124441.jpg	71-143439656--null--02-02-2019-18-35-30-514-.jpg	Ehemaliger Postbote dreht Film über den Enkeltrick
124443.jpg	polizei-symbolbild-schriftzug.jpg	Razzia von Polizei und Zoll in Köln-Kalk
124444.jpg	kirsten-jahn.jpg	Nachfolge von Kirsten Jahn offen – diese zwei Namen werden diskutiert
124445.jpg	71-143450593--null--02-02-2019-20-10-53-718-.jpg	„Kollegen werden von einer Maus im Papierkorb begrüßt“
124448.jpg	jubel-leverkusen-bayern.jpg	Leverkusen liefert einen beeindruckenden Beweis
124450.jpg	franzoesische-alpen-dpa.jpg	Schneemassen reißen mehrere Skifahrer in den Alpen mit sich
124452.jpg	bosselgruppe.jpg	Auto rast in Kegelgruppe – zwei Personen lebensgefährlich verletzt
124453.jpg	grabkammer-aegypten-020219.jpg	Grabkammer mit etwa 40 Mumien in Ägypten entdeckt
124460.jpg	wiedenest-pastor.jpg	Arnold Köster – Ein Pastor gegen die Nazis
124463.jpg	bundesagentur-fuer-arbeit-symbolbild.jpg	Immer mehr Beschäftigte in NRW haben einen Zweitjob
124464.jpg	leverkusen-pfarrsaal-st-andreas-alf-1198.jpg	Schlebuscher Katholiken stellen Immobilien auf den Prüfstand
124466.jpg	tabakwerbung.jpg	Verbot der Tabakwerbung soll ausgeweitet werden
124467.jpg	schwerlasttrage-feuerwehr-nrw.jpg	Einsätze mit fettleibigen Patienten bereiten NRW-Feuerwehr Probleme
124470.jpg	muell-auf-wiese-symbolbild-dpa.jpg	Müll in den Siegauen Thema im Umweltauschuss
124471.jpg	kuerten-spitze-flaeche-fuer-moegl--gewerbegebiet.jpg	Regenwasser müsste für geplantes Gewerbegebiet abgeleitet werden
124473.jpg	viehplaetzchen-euskirchen-muell.jpg	SPD will Sozialarbeiter einsetzen
124474.jpg	kartoffelernte-59910551.jpg	Deutsche Weltkriegs-Granate in Chips-Fabrik in Hongkong entdeckt
124475.jpg	dreifaltigkeitskrankenhaus.jpg	Wesselinger Klinik betroffen – Ministerin will GmbH unterstützen
124476.jpg	urn-newsml-dpa-com-20090101-190203-99-832370-large-4-3.jpg	Heil legt milliardenschweres Konzept für Grundrente vor
124477.jpg	hubertus-heil.jpg	Heil legt Konzept für Grundrente vor – bis zu 447 Euro plus
124478.jpg	urn-newsml-dpa-com-20090101-190203-99-832577-large-4-3.jpg	Andreas Gabalier nimmt Karl-Valentin-Orden entgegen
124479.jpg	urn-newsml-dpa-com-20090101-190203-99-832492-large-4-3.jpg	EU will Dauer von Privatinsolvenzen verkürzen
124481.jpg	urn-newsml-dpa-com-20090101-190201-99-814203-large-4-3.jpg	Vierte Freitagsdemonstration gegen Klimawandel
124483.jpg	71-143244220--null--28-01-2019-17-38-12-808-.jpg	Wie der „Schofför der Kanzlerin“ durch Deutschland reist
124485.jpg	urn-newsml-dpa-com-20090101-190203-99-832782-large-4-3.jpg	Feuerwehr hat mehr Einsätze mit fettleibigen Patienten
124486.jpg	71-143448953--null--01-02-2019-17-22-46-916-.jpg	Kölner Grabräuber auf frischer Tat ertappt
124487.jpg	symbolbild-grundschueler.jpg	Elfjährige soll Suizid begangen haben
124493.jpg	iphone-10791350512--kra2172.jpg	Fünf Sterne Deluxe bringen den Bass nach Köln
124497.jpg	vortrag-tim-rettler.jpg	Das könnte Köln beim Städtebau von London lernen
124498.jpg	dpa-whatsapp-smartphone.jpg	Prozess wegen Naziparolen in Whatsapp-Gruppe „Wurst Power“
124500.jpg	klaus-hasborn-blume-und-stephanie-overhage-eroeffnen-holocaust-ausstellung.jpg	Fritz-Bauer-Gesamtschule zeigt Holocaust-Ausstellung
124501.jpg	jan-stecker-moderator-super-bowl.jpg	TV-Moderator war Zehnkämpfer bei LGO Euskirchen
124503.jpg	haus-giersberg-dachstuhl.jpg	Bliesheimer gründen Verein, um Dorfgemeinschaftshaus zu sanieren
124506.jpg	europaschule-zollstock-030219.jpg	Rat will lang erwartete Prioritätenliste für Schulbau vorlegen
124510.jpg	71-143366434--null--01-02-2019-16-52-38-786-.jpg	Försterfamilie in Reichshof päppelt Frischlinge auf
124513.jpg	nebenjob.jpg	Immer mehr Beschäftigte in NRW haben einen Nebenjob
124515.jpg	taschenraub-symbol.jpg	Mann raubt Kölnerin die Handtasche und fährt mit KVB davon
124516.jpg	havertz-bayern.jpg	Bayer 04 muss auf Kai Havertz verzichten
124520.jpg	andreas-gabalier.jpg	Gabalier bekommt Orden und kontert Homophobie-Kritik
124523.jpg	20190202-mf-amorphis-essigfabrik-02.jpg	Amorphis bringt die Kölner Essigfabrik zum Kochen
124524.jpg	le-casting-5-.jpg	2000 Komparsen für „Die Welle” gesucht
124525.jpg	altersarmut.jpg	Wie Sie von der neuen Grundrente profitieren
124526.jpg	dpa-polizeiabsperrung-landstrasse.jpg	47-Jähriger bricht Überholvorgang ab und prallt gegen Auto
124528.jpg	fans-trauern-um-den-vermissten-emilianio-sala.jpg	Suche wird mit Spezialschiff unter Wasser fortgesetzt
124535.jpg	campus-initiative-sankt-augustin.jpg	Schulen in Sankt Augustin verstärken Kooperation
124536.jpg	polizistin.jpg	Video zeigt Polizistinnen in Umkleide – Polizei prüft Hintergründe
124537.jpg	leverkusen-schnee-alf-1047.jpg	Das Weltklima in Leverkusen beinahe im Griff
124539.jpg	junge-talente-foerderung.jpg	Wie NRW mit Talentschulen zum Vorbild für ganz Deutschland werden will
124540.jpg	urn-newsml-dpa-com-20090101-190131-99-800861-large-4-3.jpg	ZDF-Krimi „Ostfriesensünde” hat die meisten Zuschauer
124541.jpg	fretreppe-bensberg.jpg	Es wird grün an der Bensberger Schlossgalerie
124542.jpg	ein-schnitzel.jpg	Forscher kritisieren Kindergerichte in deutschen Restaurants
124544.jpg	bmx-x6-dpa.jpg	Teurer BMW in Köln-Kalk abgeschleppt
124549.jpg	tatort.jpg	„Vermögender Mann“ tot aufgefunden – Mordkommission ermittelt
124550.jpg	ein-kaninchen-auf-der-schuchtzau-in-halle.jpg	Kaninchenzüchter prügeln nach Streit aufeinander ein
124552.jpg	urn-newsml-dpa-com-20090101-190203-99-835977-large-4-3.jpg	Spannendes Aufstiegsrennen: Kiel wahrt Chancen
124554.jpg	razzia-1.jpg	Razzia mit Festnahmen in Shisha-Bars und Kneipen
124555.jpg	jacques-offenbach1.jpg	„Cäcilia Wolkenburg“ feiert den berühmten Sohn Kölns in der Oper
124556.jpg	umleitung-symbol-verkehr-neu.jpg	Opladener Straße wird ab Montag erneuert
124558.jpg	monika-und-christian-krueger.jpg	Kölner Familie betreibt eigene Manufaktur für Duftkerzen
124559.jpg	weltladen-171217.jpg	Der Weltladen mit Krippe-to-go und mafiafreiem Wein
124562.jpg	urn-newsml-dpa-com-20090101-190203-99-836736-large-4-3.jpg	Satire-Preis „Göttinger Elch” an Gerhard Haderer verliehen
124566.jpg	71-143478211--null--03-02-2019-17-25-03-101-.jpg	Aktion lockt viele Besucher ins Wipperfürther Schwimmbad
124569.jpg	71-143478217--null--03-02-2019-17-25-01-098-.jpg	Geschäft zieht zum fünften Geburtstag eine positive Bilanz
124572.jpg	71-143477229--null--03-02-2019-17-25-04-926-.jpg	Zwei neue Geschäfte eröffnen in der Marktstraße in Wipperfürth
124573.jpg	autorennen-symbolbild.jpg	Mehr illegale Autorennen in Nordrhein-Westfalen
124574.jpg	71-143482510--null--03-02-2019-17-25-25-213-.jpg	Viele nutzten das Wochenende zum Toben im Schnee
124575.jpg	donald-trump-venezuela.jpg	Donald Trump schließt Militäreinsatz der USA nicht aus
124576.jpg	71-143482743--null--03-02-2019-18-11-31-917-.jpg	Mann stirbt bei Brand in Sindorfer Wohnung
124577.jpg	kegel-ksc.jpg	Eine gute Halbzeit reicht Fortuna Köln nicht
124578.jpg	brazzo-leverkusen.jpg	Das winterliche Versagen des FC Bayern
124579.jpg	volland-bayern.jpg	Ein Sieg mit Signalwirkung
124583.jpg	urn-newsml-dpa-com-20090101-190203-99-833942-large-4-3.jpg	Scheuer hofft noch auf Vermeidung von Diesel-Fahrverboten
124590.jpg	urn-newsml-dpa-com-20090101-190203-99-834696-large-4-3.jpg	23-Jähriger stirbt bei Autounfall in Delbrück
124593.jpg	imago-sp-0203-17300004-38662947.jpg	Haie setzen die Siegesserie fort und überholen die DEG
124594.jpg	malu-dreyer-dp-aneu.jpg	SPD-Vize Dreyer teilt gegen Gerhard Schröder aus
124596.jpg	soeder-gottschalk-dpa-neu.jpg	Markus Söder überrascht Thomas Gottschalk
124599.jpg	tatort-das-verschwundene-kind-schwarze-kommissarin.jpg	Perfektes Handwerk im „Das verschwundene Kind“
124601.jpg	emiliano-sala.jpg	Fluzgzeug von Sala im Atlantik gefunden
124607.jpg	urn-newsml-dpa-com-20090101-190203-99-838851-large-4-3.jpg	Privater Wracksucher: Flugzeug von Emiliano Sala entdeckt
124609.jpg	chris-martin.jpg	Chris Martins Eskapade ins Ungewisse
124610.jpg	die-hier-schneebedeckte-betonplatte-in-kuckenberg-muss-nun-beseitigt-werden-.jpg	Kreis verlangt Abriss von Schwarzbau
124611.jpg	guido-cantz.jpg	Präsidenten schnell jeck integriert
124613.jpg	die-rumtreiber-aus-der-gegend-um-aachen-sorgten-bei-den-opladener-neustadtfunken-im-scala-fuer-stimmung-.jpg	Im Opladener Scala fröhlich gefeiert
124612.jpg	hitdorfs-prinz-mark-i--liess-sich-in-schokoriegeln-fuer-den-karnevalsumzug-aufwiegen--es-lohnte-sich-.jpg	Karnevalsprinzen mit Schokoriegeln aufgewogen
124614.jpg	urn-newsml-dpa-com-20090101-190204-99-839483-large-4-3.jpg	New England Patriots gewinnen Super Bowl zum sechsten Mal
124617.jpg	urn-newsml-dpa-com-20090101-190201-99-818004-large-4-3.jpg	Tumortherapien haben viele Langzeitfolgen
124618.jpg	urn-newsml-dpa-com-20090101-190204-99-840099-large-4-3.jpg	Chef der NRW-SPD will Arbeitslosengeld verlängern
124619.jpg	fans-brd-fahnen-dp-aneu.jpg	„Ein großes Sportereignis kann verbinden“
124620.jpg	super-bowl-2019.jpg	New England Patriots gewinnen Super Bowl
124621.jpg	71-143485494--null--03-02-2019-17-53-58-233-.jpg	Schwache Rettungsgasse und Gaffer erschweren Einsatz in Hennef
124622.jpg	operation-klinik-merheim-030219.jpg	Kölner Rat soll noch 2019 über Fusion entscheiden
124623.jpg	71-143488036--null--03-02-2019-18-19-16-821-.jpg	Abschlussbericht der Kommission in Bergheim präsentiert
124624.jpg	71-143490136--null--03-02-2019-18-30-07-928-.jpg	Tausende Wintersportler am Weißen Stein in Hellenthal
124626.jpg	dpa-strafrecht-strafgesetzbuch.jpg	Mann ergaunert Bankkredite in Bergisch Gladbach
124627.jpg	althoff-gruppe-hotelzimmer-eigelstein-030219.jpg	Althoff-Gruppe entwickelt Urban-Loft-Hotel im Kölner Eigelstein
124630.jpg	venezuela-maduro.jpg	Staatschef Maduro lässt Frist von EU-Staaten verstreichen
124632.jpg	unfall-mit-polizeiauto-in-kerpen.jpg	Immer mehr Polizeibeamte sind in Unfälle verwickelt
124634.jpg	urn-newsml-dpa-com-20090101-190204-99-840695-large-4-3.jpg	Tod einer Schülerin: Neue Aussagen von Ermittlern erwartet
124636.jpg	71-143492610--null--03-02-2019-20-17-45-886-.jpg	Schaf erblickt im Schnee das Licht der Welt
124637.jpg	gemuese.jpg	Wird Gemüse billiger, weil Briten aus der EU aussteigen?
124638.jpg	71-143465458--null--03-02-2019-17-55-26-365-.jpg	Leitplanken bei Fällarbeiten stark beschädigt
124639.jpg	andrea-buescher.jpg	Rösrather FDP will „mehr Weiblichkeit ins Rathaus bringen“
124640.jpg	im-hedrichsfeld-schule.jpg	Stadt Leverkusen will Opladener Netzwerk stärken
124642.jpg	71-143478919--null--03-02-2019-18-47-09-332-.jpg	Ausbildungsbörse präsentierte Berufe aus Industrie, Handwerk und Verwaltung
124644.jpg	adam-levine-super-bowl.jpg	Maroon 5 langweilen aus Pausenfüller
124647.jpg	anne-will-moderatorin.jpg	Eine Stunde Slapstick-Dialoge und dramatische Appelle
124651.jpg	pistole-symbolbild.jpg	Vierjähriger schießt Mutter ins Gesicht
124655.jpg	matti-nykaenen.jpg	Matti Nykänen stirbt mit 55
124656.jpg	urn-newsml-dpa-com-20090101-190201-99-817518-large-4-3.jpg	Fristlos gekündigt: Referent des Landtagspräsidenten klagt
124657.jpg	urn-newsml-dpa-com-20090101-190204-99-841576-large-4-3.jpg	Maroon 5 bieten müden Pop-Rock beim Super Bowl
124661.jpg	urn-newsml-dpa-com-20090101-190204-99-841806-large-4-3.jpg	Lily James kann manchmal explodieren
124663.jpg	hindu-tempel.jpg	Frau erstickt in Menstruationshütte
124664.jpg	71-143463506--null--03-02-2019-20-18-26-790-.jpg	Projekt soll Mittelständlern bei der Digitalisierung helfen
124666.jpg	71-143497261--null--04-02-2019-09-00-52-279-.jpg	Nachwuchs-Kreismeisterschaft in Euskirchen geplant
124667.jpg	pferdesport-dpa.jpg	Reit-Liga eine Alternative für Euskirchen?
124668.jpg	71-143465605--null--03-02-2019-17-55-37-632-.jpg	Vertrag unterzeichnet – Arbeiten beginnen im Herbst
124669.jpg	urn-newsml-dpa-com-20090101-190204-99-842484-large-4-3.jpg	9,8 Millionen sehen Kasumbas „Tatort”-Premiere
124672.jpg	david-mearns.jpg	David Mearns hat schon viele Wracks aufgespürt
124673.jpg	axel-prahl-erholungshaus-1.jpg	Ein Küsten-Springsteen spinnt Seemannsgarn
124680.jpg	donut-symbolbild.jpg	Lidl löscht umstrittene Donut-Werbung auf Facebook
124682.jpg	robben.jpg	Robben kapern Strand in Kalifornien – wegen Shutdown
124683.jpg	krebskrankes-kind.jpg	Was es für Familien bedeutet, wenn ein Kind Krebs bekommt
124685.jpg	urn-newsml-dpa-com-20090101-190204-99-841678-large-4-3.jpg	Wie Netflix & Co. die Berlinale verändern
124686.jpg	lars-bender.jpg	Bayer 04 muss vorerst auf Kapitän Lars Bender verzichten
124687.jpg	urn-newsml-dpa-com-20090101-190204-99-843620-large-4-3.jpg	Das Kölner Kultur-Wirrwarr
124689.jpg	lobinger-leipzig.jpg	Lobinger will wieder im Profi-Fußball arbeiten – Klubs zögern
124690.jpg	krokodile-in-australien.jpg	Überschwemmungen spülen Krokodile in Straßen
124691.jpg	robert-lewandowski.jpg	Ex-Nationalspieler zählt Torjäger des FC Bayern an
124692.jpg	juan-guaid%C3%B3.jpg	Deutschland erkennt Guaidó als Interimspräsidenten an
124696.jpg	71-143478333--null--03-02-2019-22-55-41-696-.jpg	Serap Güler sprach über die Herausforderungen der Integration
124697.jpg	urn-newsml-dpa-com-20090101-190204-99-844280-large-4-3.jpg	Untreueverdacht: Ermittlungen gegen Ufo-Funktionäre
124700.jpg	mark-zuckerberg-facebook.jpg	Wie Facebook trotz Skandalen immer mehr Nutzer gewinnt
124701.jpg	schneeball.jpg	Schneeball durchschlägt Kneipenfensterscheibe
124704.jpg	schwebebahn.jpg	Wuppertaler Schwebebahn wird bis August stillstehen
124705.jpg	colin-ugbekile.jpg	Kölner Haie holen Talent Colin Ugbekile
124706.jpg	ernst-vollmer-und-ralf-huepper--v-l--.jpg	Ersten Discgolf-Parcours in Köln eröffnet
124707.jpg	dpa-gewalt-an-frauen.jpg	Polizist stützt über Treppengeländer
124710.jpg	suchteam-lawine-dpa.jpg	Zahlreiche Menschen durch Lawinen getötet
124712.jpg	freitag-notarzt-symbolbild.jpg	Autofahrer von der Fahrbahn abgekommen
124714.jpg	urn-newsml-dpa-com-20090101-190203-99-832310-large-4-3.jpg	„Pulse of Europe” nimmt Spannungsbogen zur Europawahl auf
124716.jpg	sala-gedenken.jpg	Leiche in Wrack von vermisstem Fußballer Sala entdeckt
124717.jpg	aufsteller.jpg	Köln 1475 – Bömmel von den Bläck Fööss mittendrin
124727.jpg	rechtsrock.jpg	Wie Neonazis Rechtsrockkonzerte nutzen
124730.jpg	zwei-menschen-im-bewerbungsgespraech.jpg	Darf der Arbeitgeber Bewerber zum Probearbeiten verpflichten?
124732.jpg	messerangriff.jpg	Zahl der Messerangriffe – Belastbare Zahlen gibt es nicht
124735.jpg	71-143493475--null--03-02-2019-18-09-25-200-.jpg	Der neue Stadtwerke-Chef bekommt Dienstwagen
124736.jpg	rueckansicht-des-hofes--auf-dem-eine-leiche-gefunden-wurde.jpg	Angeklagter soll blutige Tatwaffe abgeleckt haben
124737.jpg	karnevalsset-koeln-titelbild.jpg	Praktische Basics für 12,95 €
124738.jpg	stadionbad.jpg	Stadionbad wird für Reparaturarbeiten geschlossen
124740.jpg	foto-wied.jpg	„In meinem Alter gibt es nur noch Nebenrollen“
124741.jpg	zschoepe-neu-afp-neu.jpg	Beate Zschäpe nach Chemnitz verlegt
124742.jpg	superbowl.jpg	Planlos auf der größten Bühne
124743.jpg	die-textilsauna-in-porz-wahn.jpg	Textilsauna in Porz-Wahn verlängert Öffnungszeiten
124746.jpg	charlotte-roche-mit-koelner-gruenen.jpg	Charlotte Roche geht in die Politik
124747.jpg	dpa-cannabis-symbolbild-dpa.jpg	23-Jähriger dealte aus seinem Kinderzimmer heraus
124748.jpg	facebook-login-symbol.jpg	64-Jährige zu hoher Geldstrafe verurteilt
124749.jpg	urn-newsml-dpa-com-20090101-190204-99-847844-large-4-3.jpg	Bayer bietet hohe Abfindungen beim Stellenabbau
124750.jpg	die-mit-dem-schwert-beschaedigte-fensterscheibe.jpg	Kölner geht nachts mit Schwert auf BMW los
124751.jpg	urn-newsml-dpa-com-20090101-190204-99-848356-large-4-3.jpg	Zweitligist Greuther Fürth trennt sich von Buric
124753.jpg	bild-ortholev-chefs.jpg	Die neue Firmenzentrale gefeiert
124754.jpg	olaf-scholz-februar-2019.jpg	Finanzminister erwartet Haushaltsloch von 25 Milliarden Euro
124762.jpg	donald-trump-februar-2019.jpg	Nachrichtenseite leaked Kalender von Trump
124764.jpg	mere-logo.jpg	Russischer Discounter Mere muss wieder schließen
124765.jpg	5f9c740057665e61.jpg	Manfred Liesendahl will sein Ratsmandat halten
124766.jpg	palmer-dpa-neu.jpg	Wie aus Boris Palmer ein Außenseiter wurde
124768.jpg	urn-newsml-dpa-com-20090101-190204-99-847801-large-4-3.jpg	„Gottschalk liest?” - tatsächlich!
124769.jpg	urn-newsml-dpa-com-20090101-190204-99-841819-large-4-3.jpg	Ryanair mit Verlust: Chef O'Leary mit neuer Rolle
124771.jpg	heizung.jpg	Schule will Energie sparen und sorgt für Kritik
124773.jpg	vorstand-koelsche-kippa-koepp.jpg	Jüdischer Karnevalsverein in Köln gegründet
124774.jpg	urn-newsml-dpa-com-20090101-190204-99-849663-large-4-3.jpg	Leergekauft: Russischer Discounter „Mere” erstmal dicht
124775.jpg	71-143522549--null--04-02-2019-18-04-13-190-.jpg	Engelskirchen winken 40 Prozent der Steuern
124777.jpg	rote-funken.jpg	Warum die Roten Funken in der Stadt mit „Kötterbüchs“ unterwegs sind
124778.jpg	bernhard-conin--l---mit-sternmarsch-organisatoren-und-sponsoren.jpg	Kölner Sternmarsch feiert jeckes Jubiläum
124779.jpg	neujahrsempfang-morsbach-3954-5-kup-17556.jpg	Bürgermeister Bukowski skizziert Pläne fürs Jubiläum
124780.jpg	eine-szene-aus-der-serie-four-blocks.jpg	Warum uns Clans in Film und Literatur faszinieren
124784.jpg	koelner-dom.jpg	Mann wegen Warnung vor Anschlag auf den Kölner Dom vor Gericht
124785.jpg	71-143521447--null--04-02-2019-18-17-52-877-.jpg	Ruh und Hoff sollen zur Tempo-30-Zone werden
124788.jpg	71-143531501--null--04-02-2019-18-41-24-199-.jpg	Interessierte können sich für Förderprogramm „Leader“ bewerben
124790.jpg	hochhaus-in-chorweiler.jpg	150 Millionen Euro für marode Hochhäuser in Köln-Chorweiler
124791.jpg	hofreiter-dpa-neu.jpg	„Regierung ist in Schockstarre“
124792.jpg	lucky-kids-philharmonie.jpg	Karnevalistische Matinee für den Kölner Rosenmontagszug
124793.jpg	buchautor-jo-hagen.jpg	Autor Jo Hagen stellt Karnevals-Roman vor
124794.jpg	unfall-ruppichteroth.jpg	Drei Verletzte nach Frontalzusammenstoß in Ruppichteroth
