img_id	img_name	title
121038.jpg	urn-newsml-dpa-com-20090101-190115-99-566005-large-4-3.jpg	Schon elf Lawinentote in Österreich
121041.jpg	horn-mallorca.jpg	Wie Timo Horn seine Chancen in der Nationalelf sieht
121042.jpg	landgericht-bonn-eingang.jpg	65-Jähriger verklagt Kontrahenten auf Schmerzensgeld
121049.jpg	modeste-mallorca.jpg	1. FC Köln hofft auf schnelle Einigung in der Causa Modeste
121050.jpg	kvb-linie-18.jpg	Frau unter KVB-Bahn eingeklemmt
121052.jpg	noah-becker-dpa-pic.jpg	AfD-Politiker muss Noah Becker Schadensersatz zahlen
121053.jpg	kaltenbachvu.jpg	Bei Unfall in Engelskirchen verletzen sich zwei Personen
121054.jpg	roesrather-strasse-in-koeln.jpg	Radfahrer von KVB-Bus überrollt
121056.jpg	urn-newsml-dpa-com-20090101-190113-99-540276-large-4-3.jpg	Jochen Malmsheimer erhält Deutschen Kabarettpreis 2018
121058.jpg	muell-vor-bergen.jpg	„Norwegische Küste wird zum Auffangnetz für Müll“
121060.jpg	juergen-roters-mit-henriette-reker.jpg	Gemälde von Alt-OB Roters im Historischen Rathaus enthüllt
121061.jpg	fabian-boehm-im-duell-mit-luka-karabatic.jpg	Deutschland kassiert Ausgleich gegen Frankreich in letzter Sekunde
121062.jpg	urn-newsml-dpa-com-20090101-190115-99-579038-large-4-3.jpg	Coup verpasst: Deutsche Handballer Remis gegen Frankreich
121063.jpg	brexit-deal-vom-parlament-abgelehnt.jpg	Die Sorge vor einem chaotischen Brexit wächst
121064.jpg	148db6005ab83745-jpg.jpg	In NRW fehlen 10.000 Pflegefachkräfte
121067.jpg	leverkusen-lkw-sporrenberger-muehle-alf-9851.jpg	Gefahrgut-Lkw fährt sich auf dem Land in Lützenkirchen fest
121068.jpg	andrea-kirchhoff--thorsten-lehmann-und-reiner-geissdoerfer-von-der-bitech-ag--christiane-meinekat-und-alexandra-engel-von-der-frauenberatungsstelle---.jpg	Ein Stück vom Büro gemietet
121072.jpg	junge-leser-werden-in-der-stadtbuecherei-nicht-erst-im-grundschulalter-betreut--sondern-schon-ab-zwoelf-monaten-.jpg	Mit Bilderbüchern auf dem Weg zur Literatur
121071.jpg	der-kita-neubau-an-der-steinbuecheler-heinrich-luebke-strasse-soll-im-april-fertiggestellt-sein-.jpg	Mehr als 1000 Kita-Plätze fehlen
121073.jpg	matera-ist-die-erste-stadt-sueditaliens--die-den-europaeischen-ehrentitel-tragen-darf-.jpg	Eine Stadt der Gegensätze
121074.jpg	urn-newsml-dpa-com-20090101-190115-99-578642-large-4-3.jpg	Weltwirtschaftsforum stellt seinen Risikobericht vor
121754.jpg	urn-newsml-dpa-com-20090101-190115-99-578664-large-4-3.jpg	Islam-Organisation Ditib stellt Pläne für den Neustart vor
121077.jpg	fanta-vier-koeln-roll-1.jpg	Alt-Rapper liefern tolle Show ab und werden politisch
121078.jpg	trevi-brunnen.jpg	Das passiert mit den Münzen aus dem Trevi-Brunnen in Rom
121079.jpg	streitgespraech.jpg	Kein Platz für Park-and-Ride – und fürs Rebhuhn
121080.jpg	spendenaktion-friesheim.jpg	Friesheimer spenden für Seniorin
121081.jpg	amtsgericht-bensberg.jpg	Richterin bricht Prozess wegen Körperverletzung ab
121082.jpg	kita-neubau-steinbuecheler-strasse.jpg	Mehr als 1000 Kita-Plätze fehlen in Leverkusen
121083.jpg	viehplaetzchen-1.jpg	Viehplätzchen-Viertel ist wieder ein Ort der Tristesse
121084.jpg	kita-symbol-bobbycar-header-kommentar.jpg	Nichts mehr schöngerechnet
121085.jpg	evelyn-und-domenico.jpg	Evelyns „Sex-Talk“ mit Domenico ist ein Fest des Trash-TV
121086.jpg	71-142717819--null--15-01-2019-18-18-54-335-.jpg	So steht es um die Katzenschutz-Verordnung in Oberberg
121089.jpg	kreissparkasse-koeln-schliesst-filialen.jpg	Kreissparkasse schließt 18 Fillialen
121090.jpg	viehplaetzchen--4.jpg	Alle müssen aktiv werden – Viehplätzchen-Viertel hat Potenzial
121091.jpg	hundebesuchsdienst-in-bruehl1.jpg	Hundewelpen verscheuchen düstere Gedanken
121092.jpg	martinilauf-01.jpg	Overath und Bergisch Gladbach erhalten Geld für den Schulsport
121093.jpg	smart-filiale-wiesdorf.jpg	Das war’s mit Smart – Filiale in Wiesdorf steht leer
121094.jpg	besuch-der-landesmedienanstalt.jpg	So verfolgt die Staatsanwaltschaft Hassrede im Internet
121095.jpg	montage-hass-im-internet.jpg	Land will härter gegen Hass im Internet vorgehen
121097.jpg	71-142713446--null--15-01-2019-16-52-15-878-.jpg	„Zukunftsschulen“ vernetzten sich über Landesprogramm
121099.jpg	urn-newsml-dpa-com-20090101-190116-99-583029-large-4-3.jpg	SC Paderborn trauert um früheren Präsidenten Finke
121102.jpg	may-unterhaus-160119.jpg	May wurde beispiellos „erniedrigt, verurteilt und verraten“
121103.jpg	urn-newsml-dpa-com-20090101-190116-99-582880-large-4-3.jpg	15 heißeste Orte der Welt alle in Australien
121104.jpg	jack-white.jpg	Jack White wird nochmal Vater – und will keine Windeln wechseln
121107.jpg	fasten-bauch-mit-sanduhr.jpg	Warum Fasten so gut ist und was Sie darüber wissen sollten
121108.jpg	flaggen-europa-grossbritannien.jpg	Welche Optionen bleiben jetzt noch?
121109.jpg	kalter-hund-capture---manuela-ruether.jpg	Erinnern Sie sich an diese Rezepte aus der Kindheit?
121110.jpg	71-141452861--null--10-12-2018-16-58-31-986-.jpg	Wasserleiche im Rhein entdeckt – Identität bisher unklar
121113.jpg	urn-newsml-dpa-com-20090101-190114-99-559579-large-4-3.jpg	Nissan Leaf als e+ mit mehr Leistung und größerer Reichweite
121114.jpg	weihbischof-ansgar-puff-als-kellner.jpg	Weihbischof verteilt Kaffee an Flüchtlinge und Obdachlose
121116.jpg	71-142720033--null--15-01-2019-16-52-08-296-.jpg	Das bietet die Volkshochschule Oberberg 2019
121118.jpg	mariawald-klausurfuehrung-12.jpg	Führungen erlauben Blick hinter einst verschlossene Mauern
121119.jpg	71-142729019--null--15-01-2019-17-20-03-173-.jpg	Politiker wollen den Ausbau des Godorfer Hafens nicht mehr
121122.jpg	fotos-ausstellung-juedisches-leben-in-deutschland.jpg	Drei Fotografen zeigen jüdisches Leben in Deutschland
121124.jpg	total%C3%A1n-spanien-junge-bohrloch.jpg	Haare gefunden – Hoffnung für Julen schwindet
121126.jpg	papst-franziskus-koelner-dreigestirn-190116.jpg	Kölner Dreigestirn von Papst Franziskus empfangen
121131.jpg	foto-lafer.jpg	Aufwand ist zu groß
121132.jpg	urn-newsml-dpa-com-20090101-190116-99-584666-large-4-3.jpg	„Ein Rohdiamant”: Italiens Kulturhauptstadt Matera
121133.jpg	arzneimittel-pillen-tabletten.jpg	Arzneimittel könnten nach Brexit knapp werden
121134.jpg	loveparade.jpg	Gericht hält Einstellung von Loveparade-Prozess für denkbar
121135.jpg	ott-boerschel-1.jpg	Ott und Börschel - Die ehemals Unantastbaren
121138.jpg	frank-strauss--henriette-reker-und-matthias-buck.jpg	Kölner Wirtschaft blickt mit Sorgen ins neue Jahr
121139.jpg	monika-b-vermisst.jpg	Leiche von vermisster Kölnerin in Australien entdeckt
121140.jpg	brexit-unterhaus-abstimmung.jpg	Die Briten scheitern an sich selbst
121145.jpg	kenia-anschlag-januar2019.jpg	Terrorgruppe Al Shabaab tötet in Nairobi 14 Menschen
121147.jpg	71-142702540--null--15-01-2019-16-42-38-227-.jpg	Toller Tipp gegen den Winterblues im Oberbergischen
121153.jpg	bahnhof-erftstadt.jpg	460 Mobilstationen im Rheinland sind möglich – 100 in Köln
121154.jpg	frau-telefoniert-mit-handy-am-ohr.jpg	Muss man im Job seine private Handynummer angeben?
121155.jpg	joel-abu-hanna-0923.jpg	Fortuna Köln verpflichtet Joel Abu Hanna
121156.jpg	sparer-verlieren-viel-geld.jpg	Deutsche Sparer verlieren 40 Milliarden Euro
121157.jpg	pflegedienst-dpa.jpg	Betrüger gibt sich als Pfleger aus – Hunderte Euro von Seniorin erbeutet
121158.jpg	71-142710246--null--15-01-2019-16-38-25-839-.jpg	Wenn’s bunt wird in der Stadt
121159.jpg	urn-newsml-dpa-com-20090101-190116-99-586873-large-4-3.jpg	Wie Möbel beim Aufräumen helfen
121162.jpg	jemand-raucht-einen-joint.jpg	So schädlich sind schon zwei Joints für Jugendliche
121164.jpg	urn-newsml-dpa-com-20090101-190116-99-587804-large-4-3.jpg	Auch DEB-Chef Reindl kritisiert ARD und ZDF: „Chance vertan”
121169.jpg	flugzeug-platz-symbolbild.jpg	Familie muss im Flieger auf schmutzigem Fußboden sitzen
121170.jpg	urn-newsml-dpa-com-20090101-190115-99-577040-large-4-3.jpg	Sanierung der Düsseldorfer Oper würde 86 Millionen kosten
121171.jpg	gillette-video-screen.jpg	Gillette-Video setzt sich gegen Sexismus ein – und wird heftig diskutiert
121176.jpg	urn-newsml-dpa-com-20090101-190116-99-588719-large-4-3.jpg	Stickstoffdioxid-Belastung an vielen Straßen rückläufig
121177.jpg	japan-bordell.jpg	Stadt Köln stoppt Bordell neben der Dompropstei
121179.jpg	koelschbuch-header.jpg	"Kölsch - Porträt einer Sprache"
121181.jpg	anfang-training-malle.jpg	FC unterliegt RCD Mallorca mit 0:1
121182.jpg	gedenkstaette-loveparade-duisburg.jpg	Gericht schlägt Einstellung des Prozess vor
121183.jpg	bliesheim-neubaugebiet.jpg	Am Kruggenberg entstehen 14 Wohneinheiten mit Bliesheimer Fernblick
121184.jpg	kerberaustralianopen.jpg	Kerber feiert Jubiläumssieg
121185.jpg	71-142712529--null--16-01-2019-10-44-27-555-.jpg	Deutsches Brotinstitut probiert sich durch – Lob für Zutaten
121186.jpg	randale-amtsgericht--2-.jpg	Streit zwischen Familien eskaliert vor Amtsgericht
121188.jpg	ku-klux-klan-waffen.jpg	Polizei gegen bundesweit gegen Ku Klux Klan vor
121189.jpg	fahndung-nach-schlaeger.jpg	Polizei sucht Verdächtigen mit dessen Instagram-Bild
121191.jpg	zuelpich-unfall-160119.jpg	Drei Schwerverletzte bei Zusammenstoß in Zülpich
121192.jpg	urn-newsml-dpa-com-20090101-190116-99-590311-large-4-3.jpg	Karnevalsprinz mit Quietsche-Ente beim Papst
121193.jpg	urn-newsml-dpa-com-20090101-190116-99-590498-large-4-3.jpg	Glyphosat: EU-Parlament fordert bessere Pestizid-Kontrollen
121195.jpg	20182506-tb-polizei-einsatzwagen-01--1-.jpg	Zwei Unbekannte bedrohen Angestellte mit Schusswaffe
121196.jpg	das-gestohlene-rad.jpg	Diebe klauen Fahrrad und Kamera ausgeparktem Auto
121198.jpg	urn-newsml-dpa-com-20090101-190116-99-590818-large-4-3.jpg	Mirjam Pressler ist tot
121200.jpg	mirjam-pressler-gestorben.jpg	Mirjam Pressler gestorben
121203.jpg	pizza.jpg	Imbissbesitzer soll Drogen in Pizzakartons geliefert haben
121204.jpg	pressebild-kuklux-clan.jpg	Razzia gegen „Ku-Klux-Klan Deutschland“ auch im Oberbergischen
121205.jpg	whatsapp-facebook-smartphone.jpg	Whatsapp soll kostenpflichtig werden – was dahinter steckt
121206.jpg	steve-pinizotto.jpg	Haie-Stürmer Pinizzotto wartet sehnlichst auf sein Comeback
121208.jpg	bild-wombat.jpg	Touristen nerven Tiere auf australischer Insel
121209.jpg	keldenich-alte-fotos-150119.jpg	Als in Keldenich noch Wein angebaut wurde
121210.jpg	sportlerwahl-rhein-berg.jpg	Wer wird Sportler des Jahres 2018 in Rhein-Berg?
121211.jpg	heizung.jpg	Kölner erbeutet als „falscher“ Heizungsableser mehr als 30.000 Euro
121215.jpg	urn-newsml-dpa-com-20090101-190116-99-592236-large-4-3.jpg	Berliner Modewoche bringt weißen Terrier groß raus
121217.jpg	amtsleiterin-kaija-elvermann.jpg	Eltern der kranken Kinder bewusst gegen Impfung entschieden
121218.jpg	chris-hemsworth.jpg	Wann ist ein Mann ein Mann?
121221.jpg	gensheimerfrankreich.jpg	Der große Traum lebt weiter
121222.jpg	york-hoeller.jpg	Interview mit Leverkusener Komponist York Höller
121223.jpg	notarzt-arzt-symbolbild.jpg	14-jährige Schülerin angefahren – Frau haute nach Erstversorgung ab
121228.jpg	unwort-anti-abschiebe-industrie.jpg	CDU-Mann hält „Anti-Abschiebe-Industrie“ für „schlicht zutreffend“
121229.jpg	deutschland-haba-jubel.jpg	DHB-Team zieht aus Remis gegen Frankreich neue Energie
121230.jpg	gruene-woche.jpg	Nümbrechter Institut für Welternährung will sich kämpferisch geben
121231.jpg	71-142577651--null--16-01-2019-17-18-23-627-.jpg	„Der FC wird aufsteigen“
121232.jpg	feuer-nuembrecht-ls-1.jpg	Prozess nach Brand im Wohnheim startet am Dienstag
121233.jpg	strasse-am-hof.jpg	Wem gehört die Kölner Altstadt?
121234.jpg	amtsgerichtwipp08-lst.jpg	Schlägerei auf der Arbeit wegen einer Frau
121235.jpg	deutsche-grammatik-varianten.jpg	„Bereits liegt in den Alpen Schnee“
121236.jpg	hochhaus.jpg	Firmen starten Immobilien-Portal für Region Köln-Bonn
121239.jpg	hacker-symbolbild.jpg	Hackerangriff möglicherweise nicht alleine von Schüler begangen
121240.jpg	71-142765023--null--16-01-2019-17-53-28-867-.jpg	Katharina Hamma klagt gegen die Kölner Messe
121243.jpg	71-142776688--null--16-01-2019-18-45-35-484-.jpg	Bund sagt Kohleländern Milliarden für Strukturwandel zu
121244.jpg	braunkohle-dpa.jpg	„Hätte mir ein bisschen mehr Ergebnis gewünscht“
121245.jpg	mercedes-g-500-dpa.jpg	Mercedes-Geländewagen in Brühl gestohlen
121247.jpg	martin-trittin.jpg	Ein kunstvoller Rundgang durch das Belgische Viertel
121249.jpg	protestaktion-im-bettenhaus-der-uniklinik.jpg	Kölner Medizinstudenten fordern bessere Bedingungen
121253.jpg	alexis-tsipras.jpg	Tsipras gewinnt Vertrauensabstimmung im Parlament
121258.jpg	plastikmuell-elfenbeinkueste.jpg	Großunternehmen wollen Plastik-Müll bekämpfen
121259.jpg	urn-newsml-dpa-com-20090101-190116-99-596003-large-4-3.jpg	Tödlicher Autobahnunfall: Gaffer öffnen Tür von Krankenwagen
121260.jpg	gericht-versicherungsbetrug.jpg	Vermeintlicher US-Soldat wollte Frauen um ihr Geld bringen
121262.jpg	a-le-plastikmuell-foto.jpg	Covestro macht bei Allianz gegen Plastikmüll im Meer mit
121263.jpg	stefan-caplan-freut-sich-ueber-den-sparerfolg-.jpg	Sanierungsplan zum Haushalt ist genehmigt
121264.jpg	die-erstklaessler-untersuchen-unter-anderem-weizenmehl-und-andere-koerner-bei-dem-projekt-im-naturgut-ophoven-.jpg	Was auf den Tisch kommen sollte
121265.jpg	documenta-kunstwerk--the-parthenon-of-books--aus-dem-jahre-2017.jpg	Die documenta als Dauerausstellung
121272.jpg	brexit.jpg	Harter Brexit trifft besonders NRW
121274.jpg	gewerbegebiet-kerpen-buir-blatzheim.jpg	Pläne für Gewerbegebiet zurückgestuft – Vorgehen der Stadt kritisiert
121275.jpg	eine-halb-geschaelte-banane.jpg	Was viele beim Bananen essen falsch machen
121276.jpg	bechen-parkstreifen-160119.jpg	Parkende Autos an der B506 in Bechen sorgen für Ärger
121277.jpg	seepark-zuelpich-lake-jump.jpg	Gartenschaugeld reicht noch zwei Jahre – Verlust trotz Besucherrekord
121278.jpg	thurn-werke.jpg	Firmen im Rhein-Sieg-Kreis fürchten schwere Folgen
121280.jpg	yotta-baelle.jpg	So viel Streit und Missgunst gab es selten im Camp
121281.jpg	71-142762595--null--16-01-2019-17-08-22-695-.jpg	Glocken in Gummersbach schweigen für gut zwei Jahre
121282.jpg	urn-newsml-dpa-com-20090101-190117-99-598328-large-4-3.jpg	Urteile im Prozess um totgeprügelten Schüler erwartet
121285.jpg	linie-18-bruehl-leere-gleise.jpg	Brühler warten weiterhin auf die Bahnen der Linie 18
121286.jpg	richterhammer.jpg	Bewährungsstrafe nach Angriff auf Polizisten
121288.jpg	marc-krueger.jpg	„Lieferumfang nach Großbritannien beträchtlich“
121290.jpg	e-regio-chef-christian-metze.jpg	Ex-Judo-Champion löst Christian Metze als e-regio-Chef ab
121292.jpg	schulbus-haltestelle-lohmar.jpg	Nach Schulschluss wird es eng an der Haltestelle
121293.jpg	maischberger-hartz-iv-runde.jpg	Christian Lindner empört sich über Hartz-IV-Empfänger
121296.jpg	stadtrat.jpg	Sind Kölner Ratspolitiker unterbezahlt?
121298.jpg	reichsbuerger-dpa.jpg	Zahl der Reichsbürger in NRW weiter gestiegen
121299.jpg	urn-newsml-dpa-com-20090101-190117-99-598996-large-4-3.jpg	Jana Ina Zarrella: Bei uns zu Hause wird nicht geschrien
121300.jpg	urn-newsml-dpa-com-20090101-190117-99-598035-large-4-3.jpg	Pink-Floyd-Schau lockt viele Fans an: Endspurt in Dortmund
121301.jpg	foto-popeye.jpg	Die Comic-Figur Popeye wird 90
121302.jpg	viele-eltern-sind-darauf-angewiesen--dass-ihre-kinder-in-einer-tagesstaette-betreut-werden-koennen-.jpg	Mehr Plätze für die Jüngsten
121303.jpg	vor-dem-gelaende-der-katholischen-grundschule-horststrasse--l---herrscht-morgens-und-nachmittags-ein-verkehrschaos-.jpg	Wendemanöver der Helikopter-Eltern sorgen für Stau
121304.jpg	der-vorstand--dieter-hoehnen--v-l----gitta-schluechter-und-thomas-schlimkowski-.jpg	Verein kümmert sich um alle Bürger
121305.jpg	bis-ende-des-jahres-bleibt-das-autonome-zentrum-nun-mindestens-an-seinem-standort-an-der-luxemburger-strasse-.jpg	Autonome bleiben bis Ende des Jahres
121307.jpg	sie-bilden-den-vorstand-des-neuen-vereins--gino-baudrie--v-l----werner-schleicher-und-thomas-mueller--foto--kaw.jpg	Mit geballter Kraft auf die Piste
121308.jpg	jubelnd-und-struessjer-verteilend-zieht-der-neue-prinz-zur-buehne--bild-l-----appelsinefunke--praesident-michael-gerhold-richtet-spaeter-grussworte-an---.jpg	Auf ein Kölsch mit dem Prinzen
121309.jpg	das-neue-gemeindezentrum-neben-der-markuskirche-wurde-im-mai-2018-nach-drei-jahren-bauzeit-eroeffnet-.jpg	Evangelische Gemeinde im Wandel
121310.jpg	dpa-stau-auf-der-autobahn.jpg	Autofahrer stehen 154.000 Stunden pro Jahr im Stau
121311.jpg	urn-newsml-dpa-com-20090101-190117-99-599090-large-4-3.jpg	Jana Julie Kilka: Vergleicht euch nicht mit anderen!
121312.jpg	alexander-graf-lambsdorff.jpg	Graf Lambsdorff spricht über Europa und den Brexit
121313.jpg	ein-privater-bauherr-hat-in-immendorf-sein-dach-begruent-und-laesst-dort-ziegen--weiden--.jpg	Grün, grün, grün sind alle Dächer
121314.jpg	aus-den-haenden-von-prinz-joerg-i-erhielt-mike-homann-ein-rathaus-zum-selberbasteln-.jpg	Beim Neujahrsempfang waren alle da
121315.jpg	die-bezirksvertretung-fordert-wartehaeuschen-an-den-bushaltestellen-in-der-ackerstrasse-.jpg	Nicht im Regen stehen lassen
121316.jpg	benedetto-gentili.jpg	Benedetto Gentili rettet desolate Gebäude in der Eifel
121318.jpg	die-13-jaehrige-gymnasiastin-catherina-cid-scholl-malt-tier--und-maedchenportraets-.jpg	Die Inspiration kommt aus ihrem Inneren
121321.jpg	streit-dpa.jpg	17-Jährige soll von Eltern ausgesperrt worden sein
121322.jpg	messstelle-nrw-dpa.jpg	Luftqualität in NRW hat sich 2018 leicht verbessert
121324.jpg	eine-frau-aus-bayern-strickte-den-verspaetungsschal.jpg	Bahn selber ersteigerte „Verspätungsschal“
121326.jpg	sek-einsatz-vingst-190117.jpg	Polizei stürmt Wohnung am Unkelshof
121327.jpg	das-kinder--und-jugendtanzcorps-der-kapelle-jonge-ist-in-den-letzten-jahren-stattlich-gewachsen-und-kann-sich-sehen-lassen-.jpg	Kapelle Jonge feiern erstmals in der Aula
121328.jpg	urn-newsml-dpa-com-20090101-190117-99-599357-large-4-3.jpg	17-Jähriger soll vier Polizisten verletzt haben
121332.jpg	verpackungen-supermarkt.jpg	Kunden zahlen für viel Luft
121335.jpg	harmony-of-the-seas.jpg	Jugendlicher stirbt bei Sturz von Kreuzfahrtschiff in Haiti
121336.jpg	kazim-tuerkmen-dpa.jpg	Neuer Ditib-Vorsitzender beschwört „Neuanfang“
121337.jpg	71-142602087--null--13-01-2019-10-38-17-328-.jpg	So wird das Sportjahr 2019 in Köln
121338.jpg	71-142776295--null--16-01-2019-18-08-44-010-.jpg	So teuer könnte der Brexit in Oberberg werden
121339.jpg	python-170119.jpg	Australische Eltern retten Sohn vor Python
121340.jpg	peter-stoeger-england.jpg	Neuer Job für Peter Stöger?
121342.jpg	baum-windeck-faellung.jpg	Gefährliche Bäume am Hang müssen weichen – Straßensperrungen
121343.jpg	luhr-abriss-maerchensiedlung-160119.jpg	Häuser in der Märchensiedlung werden abgerissen – 42 neue Wohnungen
121344.jpg	stolperfalle-boden-liblarer-rathaus.jpg	Neuer Bodenbelag wird zur Stolperfalle
121347.jpg	gewerbegebiet-leichlingen-monteferro.jpg	Die beste Nachricht für den Wirtschaftsstandort Leichlingen
121348.jpg	afd-symbol-170119.jpg	AfD-Politiker kritisieren rechten Flügel
121349.jpg	urn-newsml-dpa-com-20090101-190117-99-600550-large-4-3.jpg	Datensatz mit Millionen Passwörtern entdeckt
121351.jpg	deutsche-bahn-dpa-neu.jpg	So will die Deutsche Bahn pünktlicher werden
121352.jpg	foto-eisscheibe.jpg	Riesiges Naturphänomen in den USA sorgt für Aufsehen
121354.jpg	urn-newsml-dpa-com-20090101-190117-99-601113-large-4-3.jpg	Alaba: Wegen Aufholjagd-Trubels nicht verrückt machen
121355.jpg	urn-newsml-dpa-com-20090101-190117-99-601775-large-4-3.jpg	Industrie rechnet 2019 mit 1,5 Prozent Wirtschaftswachstum
121356.jpg	rock-dpa.jpg	Briten verbieten das Fotografieren unter Röcke
121357.jpg	mds-ksta-2018-09-03-71-137172119.jpg	Lukrative Schatten-Geschäfte mit illegalen Vermietungen
121359.jpg	dpa-alkoholtest-polizeikontrolle.jpg	Teenager fährt in Pulheim angetrunken in Zaun
121361.jpg	feinstaub-dpa-neu.jpg	Feinstaub verursacht genauso viele Tote wie Rauchen
121363.jpg	urn-newsml-dpa-com-20090101-190117-99-602209-large-4-3.jpg	WDR räumt Fehler in drei Fernsehdokumentationen ein
121364.jpg	foto-messner.jpg	Reinhold Messner glaubt nicht an Schneemenschen
121365.jpg	pizzaunfall-bergisch-gladbach-170119.jpg	26-jähriger Pizzakurier schläft hinter dem Steuer ein
121366.jpg	marco-reus.jpg	Bundesligisten im Formcheck: Und am Ende jubelt...
121371.jpg	71-142766066--null--16-01-2019-17-04-19-763-.jpg	Klinikum bringt Eltern das Wiederbeleben von Säuglingen bei
121372.jpg	urn-newsml-dpa-com-20090101-190117-99-602578-large-4-3.jpg	Nur Weltmeister Pavard fehlt beim VfB Stuttgart
121375.jpg	urn-newsml-dpa-com-20090101-190117-99-599030-large-4-3.jpg	Spahn fordert Finanzreform für Altenpflege
121377.jpg	schaeuble-dpa-neu.jpg	Schäuble nimmt die Männer in die Pflicht
121378.jpg	gericht-akten.jpg	16-Jähriger wollte schwangere Ex-Freundin töten
121380.jpg	frau-hat-grippe-und-putzt-sich-die-nase.jpg	Die Grippewelle rollt jetzt an
121382.jpg	71-142776274--null--17-01-2019-11-10-55-212-.jpg	Wesselinger Fünffachturnhalle ist wieder in Betrieb
121383.jpg	nordstrasse-kerpen-sindorf.jpg	CDU sieht Probleme in Wohngebieten
121385.jpg	overath-richtfest-170119.jpg	Overather feiern Richtfest – Gebäude soll im Herbst fertig sein
121387.jpg	kegel-bonn.jpg	Fortuna Köln unterliegt Bonn – Abu Hanna debütiert
121390.jpg	71-142780242--null--17-01-2019-13-11-15-092-.jpg	So denken in Köln lebende Briten über das Brexit-Votum
121391.jpg	urn-newsml-dpa-com-20090101-190115-99-574380-large-4-3.jpg	Chaos-Brexit bedroht das deutsche Wachstum
121392.jpg	dpa-handschellen--1-.jpg	Passanten stellen sich Einbrecher bis zur Festnahme in den Weg
121394.jpg	urn-newsml-dpa-com-20090101-190117-99-604453-large-4-3.jpg	Mieten in Großstädten steigen langsamer
121395.jpg	ringen-symbolbild.jpg	Drei Ringer für sechs Monate gesperrt
121396.jpg	facebook-daniel-hecht-familie2.jpg	Zweijähriger Paul darf wegen Diabetes nicht in die Kita
121398.jpg	polizei-blaulicht-symbolbild-dpa.jpg	Anschläge auf Polizeiwagen in Chemnitz
121402.jpg	osmanen.jpg	Ermittlungen gegen SEK-Beamten eingestellt
121407.jpg	zverev-gi-neu.jpg	Alexander Zverev quält sich in Runde 3
121408.jpg	urn-newsml-dpa-com-20090101-190117-99-604126-large-4-3.jpg	Ohne Führerschein: 16-Jähriger baut Unfall
121409.jpg	urn-newsml-dpa-com-20090101-190117-99-605593-large-4-3.jpg	BVB-Trainer Favre plant in Leipzig mit Reus und Alcácer
121413.jpg	foto-darboven.jpg	Darboven darf Jacobs-Erben nicht adoptieren
121415.jpg	71-142344302--null--07-01-2019-12-04-05-916-.jpg	Wie bezahlbare Wohnungen in der City entstehen sollen
121416.jpg	wdr-dpa-neu.jpg	WDR räumt Täuschungen bei drei Folgen ein
121418.jpg	urn-newsml-dpa-com-20090101-190117-99-605809-large-4-3.jpg	Rückkehr von Jonathas zu Hannover 96 vor dem Abschluss
121420.jpg	ganz-viele-handys-in-der-hand.jpg	Worauf Sie beim Kauf gebrauchter Smartphones achten sollten
121423.jpg	schmitz-wurst-und-fleisch.png	GS Schmitz GmbH & Co. KG
121428.jpg	oezil-erneut-hart-kritisiert.jpg	Arsenal-Legende schießt gegen Mesut Özil
121430.jpg	fuba--bayern-und-bvb.jpg	Ein Titelkampf, der endlich seinen Namen verdient
121435.jpg	urn-newsml-dpa-com-20090101-190117-99-607813-large-4-3.jpg	Winnetous Perücke: Pierre-Brice-Nachlass wird versteigert
121438.jpg	rust5275.jpg	Brand im Seniorenzentrum Köln-Riehl
121439.jpg	polizeiwagen-nahaufnahme-von-vorne.jpg	10-Jährige in Troisdorf angefahren
121441.jpg	1494c2005a8729e8.jpg	S6, S11, RE6 werden nach Schienenbruch umgeleitet
121445.jpg	bisseck-kiel.jpg	Yann Aurel Bisseck hofft auf Spielpraxis in Kiel
121447.jpg	urn-newsml-dpa-com-20090101-190117-99-607234-large-4-3.jpg	Macaulay Culkin spricht über Beziehung zu Michael Jackson
121450.jpg	symbolbild-blauzungenkrankheit.jpg	Rhein-Sieg-Kreis wird zum Sperrgebiet – Mücken als Überträger
121452.jpg	urn-newsml-dpa-com-20090101-190117-99-608640-large-4-3.jpg	Mordverdächtiger war zuvor schon 27 Jahre in Haft
121456.jpg	71-142809407--null--17-01-2019-17-27-47-617-.jpg	20 Standorte für Mobilstationen in Oberberg
121458.jpg	71-142809403--null--17-01-2019-17-02-43-118-.jpg	Ein verhältnismäßig ruhiges Jahr für Bergneustadt
121461.jpg	jonigk.jpg	Fast jeder fühlt sich als Außenseiter
121462.jpg	urn-newsml-dpa-com-20090101-190117-99-608887-large-4-3.jpg	Schlag gegen Einbrecherbande
121465.jpg	urn-newsml-dpa-com-20090101-190117-99-609282-large-4-3.jpg	Kampf gegen die Zeit bei Suche nach Zweijährigem im Schacht
121469.jpg	ellis-haie.jpg	Morgan Ellis ist der beste ausländische Einkauf des KEC
121471.jpg	71-142825913--null--17-01-2019-18-14-49-791-.jpg	Kölner Politiker wollen Kaufhof halten
121472.jpg	71-142823163--null--17-01-2019-18-08-53-040-.jpg	Stadtbücherei Wipperfürth soll ins Küchenstudio
121473.jpg	71-142829640--null--17-01-2019-18-08-53-997-.jpg	Die Idee hat bestechenden Charme
121474.jpg	polizei-koeln-hauptbahnhof-schiesserei.jpg	Polizei durchkämmt Bar Turkish Deluxe in Kalk
121477.jpg	71-142825159--null--17-01-2019-18-19-16-128-.jpg	Flughafen Köln/Bonn rechnet 2019 mit einer Million weniger Fluggäste
121478.jpg	lefloyd.jpg	Erste Nominierung für Youtube-Formate
121479.jpg	71-142828820--null--17-01-2019-18-24-02-341-.jpg	Tollitäten der Region im Bowling-Fieber
121483.jpg	toedlicher-unfall-rodenkirchen.jpg	KVB prüft Assistenzsysteme für ihre Busse
121485.jpg	71-142828671--null--17-01-2019-17-09-32-112-.jpg	Kletterpartie im ICE-Bahnhof nimmt noch lange kein Ende
121486.jpg	international-school-of-duesseldorf--5-.jpg	Fast zwölf Millionen Euro zu Unrecht vom Staat erhalten?
121487.jpg	5f98d4002034769a.jpg	Deutsche Bank offenbar in Steueraffäre verstrickt
121489.jpg	prinz-philip.jpg	Prinz Philip in Verkehrsunfall verwickelt
121490.jpg	5f9c6200bb575e16.jpg	Deutschland reist nach 31:23 gegen Serbien mit Rückenwind nach Köln
121494.jpg	urn-newsml-dpa-com-20090101-190117-99-610699-large-4-3.jpg	Britischer Prinzgemahl Philip in Autounfall verwickelt
