img_id	img_name	title
118805.jpg	knaller-symbolbild-010119.jpg	Mann wird durch Böller schwer an der Hand verletzt
118806.jpg	daniel-opoku.jpg	Wie der Kölner Daniel Opoku sein altes Leben hinter sich ließ
118807.jpg	buerojob.jpg	„Wer auf Dauer im Beruf unglücklich ist, riskiert einiges“
118808.jpg	silvester-sidney-ap-neu.jpg	Sydneys Feuerwerks-Meister unterläuft peinlicher Fehler
118809.jpg	kim-jong-un-bei-rede-010119.jpg	Kim Jong Un droht mit Abkehr vom Annäherungskurs
118810.jpg	foess-silvester-decker.jpg	Über 13.000 Fans verabschieden Bassist Hartmut Priess
118812.jpg	tokio-dpa-unfall.jpg	Mann rast mit Auto in Menschenmenge
118813.jpg	boeller-dpa-neu.jpg	Zwei Männer durch selbstgebaute Böller schwer verletzt
118814.jpg	feuerwehr-dpa-symbol-010119.jpg	Silvesterfeier mit betrunkenem Gastgeber eskaliert
118816.jpg	opladen-bahnhof-aufzug.jpg	In Opladen wächst die Bahnstadt – Autobahn bleibt Dauerthema
118817.jpg	rennes-afp-neu.jpg	Acht Menschen sitzen in 50 Meter Höhe in Karussell fest
118818.jpg	bahnuebergang-symbolbild-dpa.jpg	Mann stirbt am Neujahrsmorgen an Bahnübergang
118819.jpg	pool-billard-weltmeister-281218.jpg	Sankt Augustiner ist jüngster Weltmeister im Billardsport
118820.jpg	duerscheid-dorfplatz-271218.jpg	Förderagentur Leader will Dürscheid helfen – Infotreffen Ende Januar
118821.jpg	veranstaltungskalender-2019-nationalpark-eifel-2.jpg	Diese Veranstaltungen erwarten Gäste im Nationalpark Eifel
118822.jpg	feuerwehr-silvester-tiefgarage-1.jpg	Feuerwehr spricht von ruhigem Silvester – Brand in Garage
118823.jpg	koeln-feuerwerk-weiser-2.jpg	So schön hat Köln den Jahreswechsel gefeiert
118824.jpg	balkon-brennt.jpg	Balkon stand in Flammen – Silvesterrakete wohl Auslöser
118825.jpg	silvester-2018.jpg	Zahl gemeldeter Brände mehr als versiebenfacht
118826.jpg	milchstrasse-ueber-kreta.jpg	Kölner Fotograf reist für Bilder vom Sternenhimmel um die ganze Welt
118827.jpg	goering-eckardt-november-2018.jpg	Göring-Eckardt will neue Behörden nur noch im Osten ansiedeln
118828.jpg	symbolbild-u-bahn.jpg	Mann gerät in Düsseldorf unter U-Bahn – lebensgefährlich verletzt
118829.jpg	manchester-1.jpg	Polizei stuft Messerattacke in Manchester als Terrorismus ein
118830.jpg	unfall-burscheid-b51-3.jpg	Zwei Schwerverletzte nach Kollision auf B51 bei Burscheid
118831.jpg	tatort-1.jpg	Bud Spencer, Karl May und ein bisschen Krimi
118833.jpg	robert-habeck-0119.jpg	Habeck widerspricht Nahles zu bedingungslosem Grundeinkommen
118834.jpg	kloster-maria-frieden.jpg	Wie die Abtei „Maria Frieden“ ihren Namen erhielt
118835.jpg	b2-tweet-silvester.jpg	US-Militär entschuldigt sich für zynischen Tweet
118836.jpg	rennbahn-1.jpg	Silvesterzauber auf der Rennbahn
118837.jpg	susanne-dettlaff-281218.jpg	Wirtschaftsförderin Susanne Dettlaff verlässt Frechener Rathaus
118838.jpg	unfall-rhein-berg-silvester.jpg	Zahlen leicht unter Durchschnitt – Brände und Einbrüche
118840.jpg	feuerwehr-symbolbild-dpa.jpg	Mädchen bewahrt Elternhaus vor Feuer
118841.jpg	010119silvesternacht101.jpg	Touristin auf Toilette vergewaltigt
118842.jpg	rettungskraefte-silvesternacht.jpg	Angriffe auf Einsatzkräfte und Streitschlichter in der Neujahrsnacht
118843.jpg	polizist-zieht-waffe-vor-polizeiauto.jpg	Quettinger bedroht Nachbarn mit Schreckschusspistole
118844.jpg	schindler-kiel.jpg	Verstärkt Kevin Schindler im Januar den 1. FC Köln?
118845.jpg	5f9c42006fe98e4a.jpg	Kobayashi siegt erneut knapp vor Eisenbichler
118846.jpg	kita-symbol.jpg	So setzen die Bundesländer das „Gute-Kita-Gesetz“ um
118847.jpg	verkehrsminister-andreas-scheuer.jpg	„Pkw-Maut startet im Oktober 2020“
118849.jpg	71-142144886--null--30-12-2018-16-19-52-856-.jpg	Wie die neue Partei „Volt“ 2019 durchstarten will
118850.jpg	lanxess-arena-symbolbild.jpg	Diese Musiker wollen 2019 die Lanxess-Arena füllen
118851.jpg	neujahrsbaby-dimitra-1-010119.jpg	Dimitra kam kurz nach Mitternacht
118852.jpg	190101-uw-feuerwerk-001.jpg	Auf Nummer sicher ins neue Jahr
118855.jpg	russland-baby-explosion.jpg	Baby überlebt Nacht in eisiger Kälte
118856.jpg	tatort-2.jpg	Kurzweilige Western-Parodie mit schwacher Auflösung
118857.jpg	symbolbild-rente.jpg	Verdi kündigt Warnstreiks bei Geldtransporten an
118858.jpg	innenminister-horst-seehofer-0119.jpg	Seehofer fordert nach Angriffen in Amberg schärfere Gesetze
118860.jpg	5f9c4200f1c013d8.jpg	Van Gerwen setzt sich gegen Smith die Darts-Krone auf
118862.jpg	jacky-elaine-sorgte-mit-liedern-von-helene-fischer-fuer-tanzspass-.jpg	Auftakt der Burscheider Silvesterfeier geglückt
118863.jpg	eine-luxuslimousine-kam-nach-dem-unfall-auf-der-beifahrerseite-zum-stillstand--fahrzeugeteile-wurden-verstreut-.jpg	Zwei Schwerverletzte nach Unfall auf B51
118864.jpg	die-spielfreude-der-bayer-philharmoniker-machte-das-konzert-zu-einem-ereignis-.jpg	Letzter Höhepunkt des Jahres
118865.jpg	hinterlassenschaften-der-nacht.jpg	Hinterlassenschaften der Nacht
118868.jpg	dom-silvester-polizei.jpg	Die neue Normalität in der Kölner Silvesternacht
118869.jpg	71-142200744--null--01-01-2019-16-16-15-830-.jpg	Fährmann Weibarth über Niedrigwasser und Überschwemmungen vom Rhein
118870.jpg	grieche-opladen-laden-1.jpg	Traditionsreicher Laden „Der Grieche“ schließt in Opladen
118871.jpg	obst-und-gemuese-dpa.jpg	7 Fallen beim Essen – und wie Sie sie vermeiden
118872.jpg	71-142209532--null--01-01-2019-18-39-58-512-.jpg	Troidorfer Icedome Publikumsmagnet an Neujahr
118873.jpg	begraebniswald-reuterstrasse.jpg	Pläne für Waldfriedhof wecken in Overath Stirnrunzeln
118876.jpg	weisses-haus-020119.jpg	Trump will „Deal“ mit Demokraten machen
118877.jpg	nashorn-zoo-symbol.jpg	Kind in Zoo in den USA von Nashorn attackiert
118878.jpg	euromuenzen.jpg	Euro-Staaten wollen Münzen im Milliardenwert produzieren
118879.jpg	michael-schumacher.jpg	Michael Schumachers Familie hat Botschaft an die Fans
118923.jpg	71-142203257--null--01-01-2019-19-10-07-527-.jpg	Die Kölner Kultur-Highlights für das Jahr 2019
118881.jpg	bolsonaro-vereidigung.jpg	Bolsonaro will „Befreiung vom politisch Korrekten“ – Beifall von Trump
118882.jpg	71-142209582--null--01-01-2019-19-07-21-102-.jpg	Viele Einsätze in der Silvesternacht für Bonner Polizei
118883.jpg	71-142207635--null--01-01-2019-18-09-12-194-.jpg	So unterschiedlich hat Rhein-Berg das neue Jahr begrüßt
118884.jpg	leverkusen-autobahnbruecke-krieger2.jpg	Einstehen für Menschen, die hier leben
118885.jpg	helfer-inklusive-kurt-schroeder-aus-schaven.jpg	Das tut der Kreisverband Naturschutz für die Grube Rolf
118886.jpg	71-142207458--null--01-01-2019-16-36-20-651-.jpg	Eine Partie „Kindheit" mit Gerd Overlack und Jim Boeven
118899.jpg	madonna-020119.jpg	Schwulenklub bedankt sich bei Madonna und Sohn David
118887.jpg	bottrop-autofahrer-020119.jpg	Zahl der Verletzten in Bottrop und Essen erhöht sich
118889.jpg	donut-polizei.jpg	US-Polizei „trauert“ um ganz besondere LKW-Ladung
118890.jpg	71-142200692--null--01-01-2019-19-13-06-614-.jpg	Kürtener nähen Taschen mit Flüchtlingen – Ausstellung im Rathaus
118891.jpg	71-142198532--null--01-01-2019-18-53-22-684-.jpg	Auf den Fersen unseres Autors zu Fuß durch Siegburg
118892.jpg	haeusliche-gewalt-symbolbild.jpg	Hilfsangebote für Frauen, die in Not sind – hohe Dunkelziffer
118893.jpg	mar%C3%ADa-fern%C3%A1ndez.jpg	„In Deutschland sind Menschen mit Umgebung befreundet"
118894.jpg	71-142202887--null--01-01-2019-19-20-30-517-.jpg	Frechenerin: „Ich spüre den Druck heute noch"
118896.jpg	71-142201976--null--01-01-2019-16-50-24-686-.jpg	SV Frielingsdorf kann ab sofort seine Räume wieder nutzen
118898.jpg	tief-zeetje-ostsee.jpg	Starker Sturm beschäftigt Einsatzkräfte im Norden
118901.jpg	71-142197668--null--02-01-2019-11-31-16-740-.jpg	So läuft ein Notdienst in der Silvesternacht
118903.jpg	koffer-mit-gepaeckbanderole.jpg	Künftig sollen Passagiere immer wissen, wo ihr Koffer gerade ist
118905.jpg	waschmaschine.jpg	Bloß keine Wäsche waschen während der „zwölf Nächte“
118908.jpg	steereon2.jpg	Diese Start-ups könnten 2019 durchstarten
118909.jpg	merkel-020119.jpg	Merkel kommt nicht nach Demmin
118911.jpg	partyschiff-gesunken.jpg	Gesunkenes Partyschiff könnte bald geborgen werden
118912.jpg	silvesterbabys-020119.jpg	Diese Eltern aus Rhein-Erft hatten einen unvergesslichen Jahreswechsel
118913.jpg	afp-1bi8t5.jpg	Angreifer erschießen Bürgermeister Stunden nach Amtsantritt
118914.jpg	deutzer-bruecke.jpg	Was 2019 in Köln wichtig wird
118916.jpg	babys-charakter.jpg	Wie Kinder ihre eigene Persönlichkeit entwickeln
118917.jpg	selfie-mit-kunstwerk.jpg	Im Museum – von diesen Kunstwerken sollten Sie keine Fotos machen
118918.jpg	arbeitsmarkt-020119.jpg	Zahl der Erwerbstätigen auf Rekord seit Wiedervereinigung
118920.jpg	geisterbahn-dpa.jpg	Vater verprügelt Schausteller nach Grusel-Auftritt
118922.jpg	koschinat-sandhausen.jpg	Uwe Koschinat sorgt sich um Fortuna Köln
118924.jpg	5f9b1200972a3318.jpg	SPD in Brandenburg nur noch gleichauf mit der AfD
118925.jpg	haie-rok-ticar.jpg	KEC hofft auf Spielerlaubnis für Ticar
118926.jpg	eisenbichler-garmisch.jpg	Markus Eisenbichler will „Abstand vom Trubel nehmen“
118927.jpg	tatort-bottrop-berliner-platz.jpg	Seehofer sollte auch rechter Terror zuwider sein
118928.jpg	schuster-eisenbichler.jpg	Werner Schuster ist der Vater des Erfolgs
118936.jpg	foto-george.jpg	Der freche George ist die Nummer Eins
118937.jpg	zwerg-seidenhuhn-much.jpg	Nur das ausgeruhte Huhn ist schön
118938.jpg	capitol-kerpen-281218.jpg	Das Kerpener Capitol feiert 2019 sein 70-jähriges Bestehen
118939.jpg	der-alte-bahndam-zwischen-gladbach-und-bensberg.jpg	Gladbach zahlt mehr als 30.000 Euro für Studie zu „Cargocap“-System
118940.jpg	flamersheim-baugebiet-sportplatz.jpg	Euskirchen braucht bis 2040 mehr als 2900 Wohnungen mehr
118941.jpg	burkhard-thom-buch-hund.jpg	Burkhard Thom veröffentlicht dritte Hundeanthologie
118942.jpg	tirana-skanderbegplatz.jpg	Albaniens Sehnsucht nach Europa
118943.jpg	5f9c44001ad02a54.jpg	Urnen in Nordsee angespült – Reederei gesteht Panne ein
118946.jpg	afp-1bs9zb.jpg	Franzosen haben wenig Vertrauen in Macrons Reformen
118948.jpg	kirchenfenster-st--remigius-1--1-.jpg	Kirchenfenster von St. Remigius durch Böller zerstört
118949.jpg	capitol-hill.jpg	Die neue Macht der Demokraten
118950.jpg	christkind-020119.jpg	126.000 Briefe beantwortet das Christkind in Engelskirchen
118951.jpg	5f9afa00549f0f82.jpg	Kino bekommt Bombendrohung nach Gratis-Aktion
118952.jpg	20180210max-geister02.jpg	Geisterzug stellt besseren Radverkehr in den Mittelpunkt
118954.jpg	img-4407.jpg	Randalierer demolieren abermals Blitzer am Auenweg
118955.jpg	gerd-fingerhuth-020119.jpg	Gerhard Fingerhuth geht nach 44 Jahren in Ruhestand
118957.jpg	kobayashi.jpg	Ryoyu Kobayashi im Rausch der Geschwindigkeit
118958.jpg	gequaelte-katze-halle2.jpg	Kinder verbrennen Katzenpfötchen mit Feuerwerkskörpern
118960.jpg	polizei-feuer-schlebusch-laube.jpg	Laube brannte an Schule in Schlebusch
118961.jpg	feuerwerk-symbolbild.jpg	Dreifache Mutter an Silvester durch Metallsplitter getötet
118962.jpg	silvester-rheinsieg-020119.jpg	Kommunen beschweren sich über Müllberge durch Silvesterböller
118963.jpg	020119fasten001.jpg	Wieso zwei Lokalredakteure im Januar einen Fastenmonat einlegen
118964.jpg	71-142229920--null--02-01-2019-17-35-38-711-.jpg	Jahresheft der Nümbrechter „Heimat-Klänge“ erscheint
118965.jpg	71-141960606--null--02-01-2019-17-43-02-777-.jpg	Praktische Hilfe für das kaputte System „Familie“
118966.jpg	71-141963354--null--02-01-2019-17-42-19-325-.jpg	Diese Familie gibt Kindern aus schwierigen Verhältnissen ein Heim
118967.jpg	erweiterung-des-gewerbegebietes-klause.jpg	16 Firmen mit Interesse an Klause V
118968.jpg	cottbus.jpg	Stadt Cottbus sorgt mit Erklärung zu Messerangriff für Kritik
118969.jpg	71-142229646--null--02-01-2019-17-19-37-093-.jpg	Freilichtmuseum lädt ein zu einem Symposium
118970.jpg	gereon-eich-polizei-euskirchen-020119.jpg	Euskirchens Polizeioberrat wird Chef der Autobahnpolizei
118971.jpg	71-142233417--null--02-01-2019-18-05-18-399-.jpg	Die hohen Sicherheitsvorkehrungen werden als Erfolg gewertet
118972.jpg	landgericht-bonn.jpg	93-Jährige aus Bonn soll nach 30 Jahren ihre Wohnung räumen
118973.jpg	autoknacker.jpg	16-jährige Diebe flüchten vor Kölner Polizei
118975.jpg	berliner-platz-bottrop.jpg	Anschlag von Bottrop löst schwierige Begriffsdebatte aus
118976.jpg	linie-66.jpg	Neues Klima-Ticket ist bislang ein Ladenhüter
118977.jpg	71-142250762--null--02-01-2019-18-35-34-324-.jpg	Wilfried Schumacher soll seelsorgerische Aufgabe erhalten
118978.jpg	71-142251095--null--02-01-2019-18-38-29-221-.jpg	Präventionskampagne „Bunt statt blau“ startet
118979.jpg	amberg.jpg	Abschiebung der Tatverdächtigen nicht möglich
118980.jpg	karl-hamacher-020119.jpg	Ältester Diakon im Erzbistum Köln mit 105 Jahren gestorben
118981.jpg	bottrop-anschlag.jpg	Attentäter wütete im Verhör über „Kanaken“ und „Schwarzfüße“
118984.jpg	ticar-haie.jpg	Kölner Haie gewinnen 5:2 gegen Ingolstadt
118985.jpg	amberg--1-.jpg	Rechtsextreme patrouillieren in Amberg
118993.jpg	den-wald-der-zukunft-pflanzt-foerster-juergen-greissner-bei-immekeppel-.jpg	Nachhilfe für den Wald
118994.jpg	diese-laube-wurde-in-der-nacht-zu-mittwoch-angesteckt-.jpg	Polizei sucht nach Feuer an Schule Brandstifter
118995.jpg	71-142150835--null--02-01-2019-17-43-12-858-.jpg	Kölner darf Appartment nicht mehr vermieten – wegen fehlender „Besonnung“
118996.jpg	feuerwehr-wache-wiesdorf-4.jpg	Neue Hauptwache in Wiesdorf steht vor der Vollendung
118997.jpg	krankenhaus-mechernich.jpg	Kirchlicher Besuchsdienst in Eifeler Krankenhäusern eingestellt
118998.jpg	kr-revg-busbahnhof-horrem-ftz--5-.jpg	Rhein-Erft-Verkehrsgesellschaft ab jetzt mit eigenen Bussen unterwegs
118999.jpg	babysitter-kinderbetreuung.jpg	Babysitter erzählen, welche schrägen Regeln sie befolgen mussten
119000.jpg	lutz-urbach.jpg	Lutz Urbach gibt Ausblick – diese Themen werden 2019 wichtig
119001.jpg	zanders-bergisch-gladbach-020119.jpg	Zanders, Schloßstraße, F-Plan – wo steht Bergisch Gladbach Anfang 2019?
119003.jpg	china-mond.jpg	China gelingt Landung auf „dark side of the moon“
119004.jpg	pelosi-nach-trump-treffen.jpg	Kein Ergebnis bei Treffen der Demokraten mit Trump
119005.jpg	michael-jackson.jpg	Vom Jungen Rheinland über Edvard Munch bis zu Michael Jackson
119006.jpg	leverkusen-autobahn3-alf-8201.jpg	Straßen NRW hat 2018 Rekordsumme für Autobahnen ausgegeben
119007.jpg	ocean-cleanup-2.jpg	Aus für Riesen-Müllfänger „Ocean Cleanup“
119008.jpg	71-142230578--null--02-01-2019-17-26-06-915-.jpg	Reichshof geht begründet zuversichtlich ins 50. Jahr
119010.jpg	kaiserstrasse-historisches-foto-020119.jpg	Als der Jahrhundertwinter in den Rhein-Sieg-Kreis einfiel
119011.jpg	tv-herkenrath-020119.jpg	TV Herkenrath steht vor dem bitteren Aus
119012.jpg	stefan-hebbel.jpg	Bei Stefan Hebbel muss Kochen Spaß machen
119013.jpg	weinlokal-rheinerft-04.jpg	Diese Weinlokale locken in den Rhein-Erft-Kreis
119014.jpg	zuchtbulle-devito-aus-berg-mit-stefan-crump-und-norbert-bierth.jpg	Mit 1300 Kilo hat Devito echte Modelmaße
119057.jpg	jochen-humberg-will---nach-acht-jahren-im-amt---den-vorsitz-im-buergerverein-abgeben-.jpg	„Umgehungsstraße hat höchste Priorität“
119482.jpg	durch-die-hauseingaenge-ist-die-situation-auf-dem-rad--fussweg-oft-gefaehrlich-.jpg	Gefährliches Miteinander im Bilderstöckchen
119154.jpg	in-diesem-gebaeude-will-der-eigentuemer-des-bonntor-centers-einen-veranstaltungssaal-einrichten-.jpg	Eigentümer reicht Klage gegen Stadt ein
119015.jpg	rudolf-trum--der-letzte-stadtdirektor-von-porz--vor-einigen-jahren-an-der-groov--er-war-ein-passionierter-wassersportler-.jpg	Letzter Porzer Stadtdirektor starb mit 91 Jahren
119016.jpg	das-wappen-der-baeckerinnung-ueber-der-tuer-soll-erhalten-bleiben-.jpg	Abbruch steht unmittelbar bevor
119017.jpg	trump-030119.jpg	Donald Tump stänkert wieder gegen Deutschland
119018.jpg	71-142242366--null--03-01-2019-09-25-38-488-.jpg	„Die Sea-Watch 3 braucht Unterstützung“
119020.jpg	71-142233172--null--02-01-2019-18-05-19-717-.jpg	Das große Saubermachen nach der Silvesterfeier in Köln
119021.jpg	ilona-schmitz-aus-soetenich---kandidatin-bei-rosins-fettkampf.jpg	Ilona Schmitz aus Sötenich speckt mit Fernsehkoch ab
119022.jpg	329c4600a38cd36b.jpg	Netflix warnt vor „Bird Box“-Challenge
119023.jpg	kaese-symbol.jpg	Neun Monate Haft für Käse-Dieb von der Venloer
119024.jpg	71-142229310--null--02-01-2019-17-21-07-029-.jpg	Schwalbe-Arena wird am Samstag zum Eispalast
119025.jpg	windecker-studentin-2-1-19.jpg	Windecker Studentin gibt Tipps zur Obstaufbewahrung
119026.jpg	muellabfuhr-dpa.jpg	Moitzfelder sammelt Silvestermüll von Straße – Abfuhr lässt es liegen
119027.jpg	klopp-pep.jpg	Das Duell der Großmeister
119028.jpg	sternsinger-st--engelbert.jpg	Nachwuchsprobleme bei Sternsingern – Spenden für behinderte Kinder
119029.jpg	solarradweg-erftstadt-anzeige.jpg	Anzeige am Solarradweg funktioniert immer noch nicht
119030.jpg	daenemark-belt-bergungsarbeiten.jpg	Zahl der Opfer nach Zugunglück in Dänemark steigt
119031.jpg	bundespolizei-am-hbf.jpg	Exhibitionist uriniert in Dienststelle der Bundespolizei
119032.jpg	5f9c4200c01698b7.jpg	Große Mehrheit der Deutschen für Böllerverbote
119033.jpg	kim-jong-un-030119.jpg	Kim Jong Uns Diplomat setzt sich ab
119034.jpg	claudia-11-jahre-1996-ermordert.jpg	Mord an elfjähirger Claudia – Ermittler verfolgen neuen Ansatz
119036.jpg	gewerbsmaesziger-diebstahl02.jpg	Kölner Polizei fahndet nach Wettbüro-Dieben
119038.jpg	der-gesuchte-mann.jpg	Vermissten Rösrather zuletzt in Köln geortet
119039.jpg	titanic-wrack-museum.jpg	Im Sommer können Touristen das Wrack der Titanic besuchen
119040.jpg	fahrrad-faehrt-auf-fahrradweg.jpg	42-Jährige in Hürth von drei Männern überfallen
119041.jpg	joerg-kachelmann-dpa.jpg	Kachelmann-Comeback mit Lampenfieber
119042.jpg	flughafen-koeln-data.jpg	Ryanair lässt 19-Jährigen im Rollstuhl nicht mitfliegen
119046.jpg	euronics-bruehl-030119.jpg	Euronics-Filiale in Brühl schließt Ende Januar
119049.jpg	71-142235151--null--02-01-2019-17-15-08-114-.jpg	Weihnachten und Neujahr fern der Heimat
119050.jpg	ko-samui-chaweng-thailand.jpg	Thailand-Urlauber fliehen vor „Pabuk“
119051.jpg	leon-draisaitl-nhl.jpg	100 Scorerpunkte sind keine Utopie mehr
119052.jpg	71-141747307--null--02-01-2019-15-11-38-691-.jpg	Mehr Platz für Natur und Umweltbildung
119054.jpg	eu-schauspiel-patientin-jule-rueber-04.jpg	Euskirchener Schauspielerin trainiert mit angehenden Ärzten
119060.jpg	schumacher-todt-181012.jpg	Zahlreiche Glückwünsche für Michael Schumacher zum 50.
119061.jpg	lidl-regal-supermarkt.jpg	Tschechische Supermärkte müssen Lebensmittel zum Gemeinwohl abgeben
119062.jpg	hannover-96-trainingsauftakt.jpg	Hannover 96 mit Verspätung ins Trainingslager
119063.jpg	joggende-frau.jpg	Einfach mal nichts vornehmen
119064.jpg	container-von-zoe.jpg	Container der „Zoe“ sind Gefahr für Menschen und Schiffe
119065.jpg	moritz-mueller-comeback.jpg	Haie-Kapitän Moritz Müller vor Comeback
119068.jpg	notarzt-im-einsatz-dpa.jpg	Notarzt twittert über zunehmende Gewalt bei Rettungseinsätzen
119070.jpg	der-unfall-lastwagen.jpg	Lastwagen fährt unter zu niedrige Brücke
119072.jpg	re5-dpa.jpg	Nahverkehrsverbände unzufrieden mit Deutscher Bahn
119073.jpg	5f9c460064ed049a.jpg	Staatsanwaltschaft fordert fünf Todesurteile
119075.jpg	unfall-deutzer-ring.jpg	Sechs Autoinsassen flüchten nach Unfall vor Kölner Polizei
119076.jpg	kraftwerk-niederaussem-030119.jpg	Störfall in Block C des Kraftwerks Niederaußem
119077.jpg	71-142251099--null--03-01-2019-15-34-48-749-.jpg	Wenn der „Notfall“ dreimal anruft
119078.jpg	das-ungekuehlte-fleisch.jpg	Polizei stoppt Transporter mit ungekühltem Fleisch
119081.jpg	le-bild-zaun-a1-baustelle.jpg	Neue Einhausung über der Baustelle wird errichtet
119083.jpg	erstes-leverkusener-rathaus.jpg	Leverkusen, wie es einmal war
119084.jpg	wohnungseinbruch-01.jpg	Polizei Köln sucht Einbrecher-Duo
119085.jpg	der-wagen-mit-den-einschussloechern.jpg	Schütze feuerte auf Mann – Schüsse für Böller gehalten
119086.jpg	soldaten-zelte.jpg	Bevölkerung hatte Angst vor „Menschenfressern“
119087.jpg	das-iphone-x.jpg	Chipkonzern verbietet Apple den Verkauf dieser iPhone-Modelle
119088.jpg	afp-1by368.jpg	Die mächtigste Gegenspielerin von Donald Trump
119089.jpg	kvb-bahn.jpg	KVB-Bahn der Linie 1 stößt mit Auto zusammen
119090.jpg	vibratoren.jpg	Diese Erotikspielzeuge lassen sich ganz einfach ausspionieren
119092.jpg	a3-symbolbild--1-.jpg	Lauterbach spricht über saubere Luft und Autobahnpläne
119093.jpg	schnabelsmuehle-techniker-030119.jpg	Ursache für Laternenausfall am Kreisel Schnabelsmühle behoben
119094.jpg	symbolbild-blaulicht-polizei.jpg	Jugendliche bei Zigarettenautomaten-Sprengung ertappt
119095.jpg	71-142277226--null--03-01-2019-17-12-44-761-.jpg	Student Nico Lewin gewinnt Publikumspreis
119096.jpg	katzenwesen-rollenspiel.jpg	Larp – die Lust, ein paar Tage ein anderer zu sein
119097.jpg	71-142280735--null--03-01-2019-17-12-14-694-.jpg	Im Februar soll erstmals im neuen Bürgerdorf getagt werden
119098.jpg	5f9c420065c390a4.jpg	Bundesagentur-Chef plädiert für Reform – SPD in der Kritik
119099.jpg	71-142245131--null--03-01-2019-10-04-50-281-.jpg	Wie alltagstauglich ist die kölsche Sprache noch?
119100.jpg	71-142280084--null--03-01-2019-17-24-10-188-.jpg	Diabetes – Eine Krankheit als Begleiter fürs Leben
119101.jpg	queens-royal-west-surrey-regt-with-grandpa-gilbert--1-.jpg	Dieses Bild aus Lindlar reiste um die halbe Welt
119102.jpg	eisenbichler-innsbruck-quali.jpg	Markus Eisenbichler ist auf dem Weg zum Siegspringer
119103.jpg	dpa-finanzamt-einwurf-in-briefkasten-von-finanzamt.jpg	In Finanzämtern drohen Streiks – sechs Prozent mehr Lohn gefordert
119104.jpg	stammtisch-e-mobilitaet-hilden-baecker-schueren.jpg	Der Revolutionär aus der Backstube
119105.jpg	verfolgung-nacht.jpg	50-Jähriger rammt Auto auf A555 bei Wesseling
119106.jpg	neuer-bayern.jpg	Die Aura von einst ist verblasst
119107.jpg	5f9c4600d806ea3e.jpg	Geteilte Macht ist die Neue Hoffnung für Amerika
119108.jpg	71-142247035--null--03-01-2019-18-41-24-170-.jpg	Darum verliert die Kölsch-Band Lupo ihren Sänger
119109.jpg	ryanair-flugzeug-flughafen-koeln-bonn.jpg	Flughafen Köln/Bonn profitiert von Ryanair-Wachstum
119110.jpg	dbb-deutscher-beamtenbund-streik-forderung.jpg	„Mehr Lohn statt Schuldenabbau“
119111.jpg	schumacher-plakat-030119.jpg	Kerpener Fanclub-Vorsitzender gratuliert Michael Schumacher im Radio
119113.jpg	das-krankenhaus-porz-am-rhein.jpg	400 Menschen demonstrieren vor Krankenhaus Porz am Rhein
119114.jpg	unfall-waldbroel-hahn.jpg	Waldbrölerin wird bei Unfall lebensgefährlich verletzt
119115.jpg	71-142292826--null--03-01-2019-18-17-11-615-.jpg	Stadt Bonn wird blaue Telefone nicht los
119121.jpg	dschungelcamp.jpg	Diese Kandidaten ziehen 2019 ins Dschungelcamp
119123.jpg	die-premiere-des-witzheldener-weihnachtsmarktes-war-ein-voller-erfolg--3000-euro-betraegt-der-spendenerloes-.jpg	„Sternenzauber“ ist geglückt
119124.jpg	71-142238782--null--02-01-2019-17-43-12-858-.jpg	Politiker und Immobilienbesitzer kritisieren die Stadt
119125.jpg	frau-trainiert-an-den-gewichten-im-fitnessstudio.jpg	So beeinflussen Fitnesstrainer, ob wir unseren Körper hassen oder lieben
119126.jpg	ville-express-030119.jpg	Nachbarn des asbestbelasteten Ville-Express schreiben an Verwaltung
119127.jpg	klein-s-eck-in-hennef-030119.jpg	Sparkästchen im Lokal Klein’s Eck in Hennef geplündert
119128.jpg	silvesterfeuerwerk-2018.jpg	Grüne fordern Einschränkungen fürs Feuerwerk
119129.jpg	postbank-winkelpfad-030119.jpg	Zukunft der Postbankfiliale am Winkelpfad weiter offen
119130.jpg	coverstro-leverkusen-symbolbild.jpg	Chempark steht vor Jahr mit viel Ungewissheit
119131.jpg	marie-brand-krimi.jpg	„Kampfszenen müssen so dahingeschissen aussehen“
119132.jpg	shutdown-notice.jpg	Kein Ende des US-Shutdowns in Sicht
119133.jpg	mexiko-schild.jpg	Zwei Kinder aus Händen von Lev Tahor befreit
119134.jpg	weihnachtsmarkt-roncalliplatz.jpg	Immer mehr asiatische Touristen lieben Kölner Weihnachtsmärkte
119135.jpg	wellen-pabuk.jpg	Tropensturm „Pabuk“ zieht über Thailand
119136.jpg	blaumeise.jpg	Nabu ruft am Wochenende zur Mitmach-Aktion auf
119137.jpg	hambacher-forst-mahnwache-0301119.jpg	Polizei kontrolliert auch nachts – Aktivisten warnen sich per Twitter
119138.jpg	mgv-seelscheid-030119.jpg	Chor gewinnt neue Sänger dank dieses Plakats
119416.jpg	mechernich-haushaltsplan-030119.jpg	Mechernicher können sich bald online über Haushalt informieren
119139.jpg	mitfahrerbank-kuerten-030119.jpg	Mitfahrerbänke-Projekt läuft in Kürten schleppend an
119142.jpg	rauchgas-niederaussem-040119.jpg	Methanol soll ohne fossile Brennstoffe hergestellt werden
119143.jpg	screenshot-hacker--1-.jpg	Hacker veröffentlichen Daten von deutschen Politikern
119144.jpg	container-dpa-neu.jpg	Polizei Duisburg prüft Hinweise zum gefundenen Beutel
119145.jpg	bahn-dpa-030119.jpg	Personalmangel bei Lokführern führt zu massiven Zugausfällen
119146.jpg	erkelenz-widerstand-braunkohle-dpa.jpg	RWE: Umsiedlung am Tagebau Garzweiler geht weiter
119148.jpg	doebeln.jpg	Explosion vor AfD-Büro in Sachsen
119151.jpg	71-142277222--null--03-01-2019-17-13-03-379-.jpg	Morsbach baut an der Zukunft – nicht nur am Bahnhof
119152.jpg	ba-pic-dpa.jpg	Arbeitslosigkeit auf niedrigstem Stand seit Wiedervereinigung
119153.jpg	michael-spavor--kanadischer-korea-experte.jpg	13 Kanadier in China festgenommen
119155.jpg	kind-krankenhaus.jpg	Mutter warnt vor magnetischem Spielzeug
119157.jpg	mavraj.jpg	Ex-Kölner Mavraj vor Rückrunden-Duell mit dem FC
119190.jpg	landwirtschaft-im-rhein-sieg-kreis-luftaufnahme.jpg	Landwirte wollen Betriebe mit kreativen Ideen retten
119160.jpg	polizei-symbolfoto.jpg	Mann wirft Hündin von Brücke in die Ruhr – Zeugen gesucht
